Sara wants to buy a jacket and 2 new pairs of shoes. The jacket she wants costs $30 and each pair of shoes costs $20. Sara babysits her neighbor's kids 4 times and she earns $5 each time she babysits. Her parents pay her $4 every time she mows the lawn. If Sarah already had $10 saved before she started babysitting, how many times will she have to mow the lawn before she can buy a jacket and shoes?	10
Jerry has a chicken coop. Red chickens lay 3 eggs per day and white chickens lay 5 eggs per day. Every day, Jerry collects 42 eggs. If he has two more white chickens than red chickens, how many red chickens does he have?	4
Gary likes to walk along the edge of the local park, which is a rectangle measuring 1.5 miles by 6 miles. If he walks at 3 miles/hour, how many hours does he spend walking?	5
While at the Dollar Store, Sloane counts 100 customers entering the store. The next day, she counts 50 more clients than the first day. If the total number of customers at the end of the third day was 500, how many customers did he count on the third day?	250
Jerry has two pools, both with leaks that drain them at a rate of 4 gallons/minute. 4 minutes ago, the large pool had the same amount of water as the small pool. Now, the large pool has four times the amount of water in the small pool. How much water does the small pool have now?	8
Lori wants to buy a pair of $320.00 shoes and a matching belt, which costs $32.00. For her part-time job she charges $8.00 an hour. How many hours must she work before she can make her purchase?	44
Janeth borrowed $2,000 and promised to pay it back with an additional 10% on the amount. If she is going to pay $165 per month for 12 months, what balance will Janeth have left to pay by then?	220
There are 4 roses in the vase. There are 7 more dahlias than roses in the vase. How many flowers are there in total in the vase?	15
Adrian's age is three times Harriet's age, and Harriet is half Zack's age. Find the average age of the three in three years if Harriet is now 21 years old.	45
Four students scored a total of 251 points in a board game. Naomi scored 68 of the points. Yuri scored 10 more than half as many points as Naomi and Brianna scored 17 more points than Naomi. How many points did Jojo score?	54
It takes Carmen 10 minutes to finish a crossword puzzle and 5 minutes to finish a Sudoku. Over the weekend, she solved 3 crossword puzzles and 8 sudoku puzzles. How much time did she spend on these games?	70
A water tank is filled with 120 liters of water. Celine used 90 liters of water from the tank to water her small garden. Then, she was able to collect rainwater, which was double the amount she had left. How many liters of water are in the tank now?	90
Andy plants 90 geraniums and 40 fewer petunias than geraniums. How many flowers do you plant in total?	140
A company spends $15,000 on advertising for one year and then spends one-third of that amount on advertising for another year. What is the total amount the company spent on advertising during the two years?	20000
Carlos and Benji are at the beach. Carlos rents a canoe for $30 an hour and Benji rents a banana-shaped rubber boat for $18 an hour. If Carlos uses the boat for 3 hours and Benji uses the rubber boat for 5 hours, how much will they pay in total for the rentals?	180
Andrew plans to take a road trip from New Jersey to Rochester. It takes 6 days to travel by bus and half as many days to travel by car from New Jersey to Rochester. How many days will he travel if he plans to go to Rochester by bus and return from Rochester by car?	9
James is counting his Pokémon cards. He has 30 fire type, 20 grass type and 40 water type. If he loses 8 water type and buys 14 grass type, what is the percentage chance (rounded to the nearest integer) that a randomly chosen card will be a water type?	33
Chad ordered a custom burrito for lunch. The base burrito costs $6.50. He adds an additional beef for $2.00, an additional cheese for $1.00, avocado for $1.00 and 2 sauces for $0.25 each. He decides to upgrade his meal for $3.00 more, which will allow him to add potatoes and a drink. He has a $5.00 gift card that he uses at checkout. How much money does he still owe?	9
Kalinda is putting together a 360-piece puzzle with her mom. Typically, Kalinda can add 4 pieces per minute. His mom can typically locate half as many pieces per minute as Kalinda. How many hours will it take you to put together this puzzle?	1
A watermelon plantation produced 120 small watermelons. Ashlyn went to the farm two months later and discovered that 30% of the watermelons were ready to harvest, so he took them to her house. When she returned two weeks later, 3/4 of the remaining watermelons were ready, so she harvested them. How many watermelons were not ready to harvest after two weeks?	21
Mark purchases a fleet of 12 cars for his company. Each car sells for $20,000. He pays 10% tax on the vehicles and then another $1,000 to register each of them. How much does he pay for everything?	276,000
Kylie and Robert love going to the beach to collect shells. On Monday, Kylie collects 5 more shells than Robert, who collects 20 shells. On Tuesday, Kylie collects 2 times as many shells as she collected on Monday. How many shells does Kylie collect on Tuesday?	50
Dax went to his farm to pick some apples and found half as many bugs as ants in the orchard. If there were 50 ants, he calculated the total number of insects in the garden.	75
There are 36 penguins sunbathing in the snow. A third of them jump into the ocean and start swimming. Another third heads towards a cave to feed. How many penguins were still sunbathing?	12
Steve decides to start eating more tomatoes and decides to grow his own cherry tomatoes. He eats twice as much as his girlfriend. Eat 6 a day. If one branch can produce 3 tomatoes per week, how many branches does it need?	21
John orders some pizzas to share with his friends. There are 20 friends in total, and John wants to make sure that each one can eat 4 servings. Pizzas are only sold cut into 8 slices. How many pizzas should John order?	10
Ram uses a lot of pens. He realized that he can save money if he mixes the ink from five empty pens to fill one full pen. If he buys 25 pens and then uses them to make new pens when they are running out of ink, how many pens does he end up having in total?	31
Johnny took his $20 allowance and added $10 more. Then he invested this sum of money, which tripled in one year. How much money did he have after one year?	90
Mary is two years younger than Joan, who is five years older than Jessa. If Jessa is 20 years old, how many years do the three girls' ages add up?	68
The number of students in a school hall was 1000. The hall had 3 entrances: A, B and C, which were also used as exits. If after an assembly, 30% of the students left the building through exit A, 3/5 of the remaining students left through exit B, and the rest left through exit C, calculate the number of students who left through exit exit C.	280
James has 6 more candies than Robert. John has twice as many candy as Robert. If John has 54 candies, how many more candies does John have than James?	21
Dolly has two books. Pandora has one. If both Dolly and Pandora read their own books and each other's books, how many books will they end up reading together?	6
Mike was pen pals with 5 people. He stopped being pen pals with 2 of them. Each sends 2 letters per week of 5 pages in length. He responds in the same way. He can write a page every 6 minutes. How many hours does he spend writing per week?	3
Jason has a phone plan of 1000 minutes per month. Every day he has a 15-minute call with his boss and, this month, he has had an extra 300 minutes of calls to other people. How many unused minutes does Jason have left if this month has 30 days?	250
Griffin has 24 chips, but Kyle got 5. Billy got twice as many as Kyle. Ginger gave Griffin a handful of her fries, and then Colby took out 3 fewer fries for Griffin than the amount Kyle had taken out. If Griffin ended up with 27 fries, how many fries did Ginger give Griffin?	20
There are 4 snails in one aquarium and 32 snails in another aquarium. The difference between the number of snails in the two aquariums is twice the number of fish in both aquariums. If both aquariums have the same number of fish, how many fish are there in each aquarium?	7
Jeans' makeup artist charges her $250 an hour. Jeans needs very expensive makeup for a movie he is filming and it takes him 6 hours to do it every day, and he needs it 4 times a week. The film takes 5 weeks to finish. After finishing the movie, the makeup artist gives Jean a 10% discount for the volume of work done. How much did Jean pay?	27000
Isabelle bought party supplies for her little sister's birthday party. She spent $12 on cake ingredients, $43 on birthday gifts, $15 on decorations, $4 on invitation cards, and $22 on goody bags for party guests. She split the cost three evenly with her father and her mother. How many dollars did each person pay?	32
A chef bought 4 bags of onions. Each bag weighs 50 pounds. A pound of onions costs $1.50. How much money did the chef spend?	300
On Monday, Sue ate 4 times as many cookies as her sister. On Tuesday, she ate twice as many cookies as her sister. Her sister ate 5 cookies on Monday and 13 the next day. If 1 cookie has 200 calories, how many more calories did Sue consume than her sister?	5,600
