Janet's ducks lay 16 eggs per day. She eats three for breakfast every morning and uses four to bake muffins for her friends every day. She sells leftovers at the farmers market daily for $2 a fresh duck egg. How much do you make in dollars every day at the farmers market?	18
A robe takes 2 rolls of blue fabric and half that amount of white fabric. How many rolls are needed in total?	3
Josh decides to try to remodel and sell a house. He buys an $80,000 home and then adds $50,000 for repairs. This increases the value of the house by 150%. How much profit did you make?	70000
James decides to run 3 sprint races 3 times a week. He runs 60 meters in each sprint. How many meters does he run in total per week?	540
Every day, Wendi feeds each of her chickens three cups of mixed chicken feed containing seeds, larvae, and vegetables to help them stay healthy. She feeds the chickens three separate meals. In the morning, she feeds her flock of chickens 15 cups of feed. In the afternoon, she gives him another 25 cups of food. How many cups of feed does she need to give to her chickens at the last meal of the day if Wendi's flock size is 20 chickens?	20
Kylar went to the store to buy glasses for his new apartment. One glass costs $5, but every second glass is only 60% of the price. Kylar wants to buy 16 glasses. How much money do you need to pay them?	64
In Toulouse there are twice as many sheep as in Charleston. There are 4 times more sheep in Charleston than in Seattle. How many total sheep are there in Toulouse, Charleston, and Seattle if there are 20 sheep in Seattle?	260
Carla is downloading a 200 GB file. Typically you can download 2GB per minute, but at 40% of the download, Windows forces a reboot to install updates, which takes 20 minutes. Then Carla has to restart the download from the beginning. How long does it take to download the file?	160
John drives for 3 hours at 60 mph and then turns around because he realizes he forgot something very important at home. He tries to get home in 4 hours, but spends the first 2 hours in a traffic jam. For the next half hour he drives at a speed of 30 mph before being able to drive the remaining 4 hours at 80 mph. How far from home is he at the end of those 4 hours?	45
Eliza's hourly rate for the first 40 hours of work each week is $10. You also receive overtime pay of 1.2 times your regular hourly rate. How much does Eliza earn this week if she worked 45 hours?	460
A new program had 60 downloads in the first month. The number of downloads in the second month was three times more than the downloads in the first month, but then decreased by 30% in the third month. How many total downloads did the program have during the three months?	366
Toula went to the bakery and bought different types of cakes. She purchased 3 dozen donuts that cost $68 a dozen, 2 dozen mini cupcakes that cost $80 a dozen, and 6 dozen cheese pancakes that cost $55 a dozen. How much did everything cost?	694
Carlos plants a lemon tree. Planting the tree will cost you $90. Each year he will give 7 lemons, which he can sell for $1.5 each. Watering and nourishing the tree costs $3 a year. How many years will it take you to start making money from the lemon tree?	13
Melanie is a home salesperson. She sold a third of her vacuum cleaners in the green house, 2 more in the red house, and half of what she had left in the orange house. If Melanie has 5 vacuum cleaners left, how many did she have at the beginning?	18
In a dance class of 20 students, 20% were enrolled in contemporary dance, the rest 25% were enrolled in jazz dance, and the rest were enrolled in hip-hop dance. What percentage of the total students enrolled in hip-hop dance?	60
A merchant wants to choose between 2 purchasing plans: jewelry worth $5,000 or electronics worth $8,000. His financial advisor speculates that the jewelry market will rise 2.5% while the electronic devices market will rise 1.2% in the same month. If the trader wants to choose an option that will allow him to maximize the profit at the end of this month, how much would this profit be?	125
Two trains leave San Rafael at the same time. They begin traveling west, both traveling 80 miles. The next day, they travel north and travel 150 miles. How far did each train travel on the two days?	230
Jill is paid $20 an hour for teaching and $30 for coaching cheerleading. What is her annual salary if she works 50 weeks a year, 35 hours a week as a teacher and 15 hours a week as a coach?	57500
Claire makes an omelette with 3 eggs every morning for breakfast. How many dozen eggs will she eat in 4 weeks?	7
Marissa goes hiking on a 12-mile trail. It took her 1 hour to walk the first 4 miles, then another hour to walk the next two miles. If she wants her average speed to be 4 miles per hour, at what speed (in miles per hour) should she walk the rest of the distance?	6
I have 10 liters of orange soda containing two-thirds water and I want to add it to 15 liters of pineapple soda containing three-fifths water. But when I poured it, I spilled a liter of orange soda. How much water is in the remaining 24 liters?	15
Raymond and Samantha are cousins. Raymond was born 6 years before Samantha. Raymond had a son when he was 23 years old. If Samantha is now 31 years old, how many years ago was Raymond's son born?	14
Billy sells DVDs. On Tuesday he receives 8 clients. His first 3 clients buy a DVD each. The next 2 customers buy 2 DVDs each. The last 3 customers do not buy any DVDs. How many DVDs did Billy sell on Tuesday?	7
A candle melts 2 centimeters every hour it is lit. How many centimeters shorter will a candle be after burning from 1:00 p.m. m. at 5:00 p.m. m.?	8
Kyle bought last year's best-selling book for $19.50. This is 25% off the original price. What was the original price of the book?	26
Marie ordered a chicken meal that costs $12, 5 cartons of milk that cost $3 each, 4 manzas that cost $1.50 each, and some boxes of pizza. Marie paid a total of $50. How many boxes of pizza did Marie order if each box costs $8.50?	2
Mishka bought 3 pairs of shorts, 3 pairs of pants and 3 pairs of shoes. A pair of shorts costs $16.50. A pair of pants costs $22.50 and a pair of shoes costs $42. How many dollars did Mishka spend on all the clothing items?	243
Cynthia eats a serving of ice cream every night. She purchases boxes of ice cream with 15 servings of ice cream each at a cost of $4.00 per box. How much will she spend on ice cream after 60 days?	16
Henry made two stops during his 60-mile bike trip. He first stopped after 20 miles. His second stop was 15 miles before the end of the trip. How many miles did he travel between the first and second stops?	25
Gloria is shopping for shoes when she sees a pair of boots that fit her shoe budget. However, she must choose between the boots and two pairs of high-heeled shoes that together cost five dollars less than the boots. If one pair of high heels costs $33 and the other costs twice as much, how much do the boots cost?	104
The ratio of Darrell and Allen's ages is 7:11. Calculate Allen's age in 10 years if their total age now is 162.	109
Gunter is trying to count the jelly beans in a jar. He asks his friends how many they think are in the jar. One says 80. Another says 20 more than half of the first. A third says 25% more than the first. What is the average calculation of it?	80
John takes care of 10 dogs. It takes each dog half an hour a day to walk and relieve himself. How many hours a week does he dedicate to taking care of the dogs?	35
Gretchen has 110 coins. There are 30 more gold coins than silver. How many gold coins does Gretchen have?	70
Siobhan has 2 less jewels than Aaron. Aaron has 5 more jewels than half of Raymond's jewels. If Raymond has 40 jewels, how many jewels does Siobhan have?	23
Mike plays ping pong for 40 minutes. In the first 20 minutes, he wins 4 points. In the second 20 minutes, he earns 25% more points. How many points did he earn in total?	9
Terry eats 2 yogurts a day. There is currently a deal on 4 yogurts for $5. How much do you spend on yogurt for 30 days?	75
John plans to sell all his toys and use the money to buy video games. He has 13 Lego sets that he sells for $15 each. He ends up buying 8 video games for $20 each and has $5 left over. How many Lego games do you still have left?	2
John runs 60 miles a week. He runs 3 days a week. The first day he runs 3 hours and half of what he runs the other two days. How fast does he run?	10
Dana can run at a speed four times faster than she can walk, but she can jump at a speed that is half as fast as she can run. If she can jump at 3 miles per hour, how many miles can she go in six hours if she runs one-third of the time and walks two-thirds of the time?	18
Brandon's iPhone is four times older than Ben's iPhone. Ben's iPhone is twice as old as Suzy's iPhone. If Suzy's iPhone is 1 year old, how old is Brandon's iPhone?	8
The great dragon, Perg, sat atop Mount Farbo, breathing fire at everything within 1,000 feet. Polly could throw the golden javelin, the only weapon known to kill the dragon, a distance of 400 feet, well within reach of the dragon's flames. But when Polly had the sapphire gemstone, she could throw the javelin three times as far as she could when she didn't have it. How far outside the reach of the dragon's flames could Polly stand so she could hit the dragon with the golden javelin while holding the precious stone?	200
Grandma Jones baked 5 apple pies for the firefighter lunch. She cut each cake into 8 slices and placed the five cakes on the buffet table for guests to help themselves. At the end of the night, after the guests had helped themselves and eaten the slices of cake, there were 14 slices left. How many servings did the guests serve?	26
According to the nutritional information, a package of potato chips has 250 calories per serving. If a 300g bag has 5 servings, how many grams can you eat if your daily calorie goal is 2000 and you have already consumed 1800 calories?	48
Charlie wants to sell beeswax candles. For every pound of beeswax, he can make 10 taper candles. A pound of beeswax and wicks cost $10.00 in supplies. If he sells each candle for $2.00, what will be his net profit from making and selling 20 candles?	20
Meredith is a freelance blogger who writes about health topics and delivers to her clients daily as a permanent job. A blog article takes an average of 4 hours between research and preparation. Last week, Meredith wrote 5 articles on Monday and 2/5 times as many articles on Tuesday as she did on Monday. On Wednesday, she wrote twice as many articles as she did on Tuesday. Calculate the total number of hours Meredith spent on the articles over the three days.	104
Candice put 80 sticky notes in her purse before leaving for her job at the coffee shop. On the way, she stopped at the store and bought a pack of sticky notes. At work, she placed a single sticky note on each of 220 different coffee cups. If she has 23 sticky notes left in total, how many sticky notes were there in the package she purchased?	163
John buys twice as many red ties as blue ties. Red ties cost 50% more than blue ties. He spent $200 on blue ties that cost $40 each. How much did he spend on ties?	800
Tracy used a 4-foot-long piece of wire to support the tomato plants in the garden. She cut the wire into 6 inch long pieces. How many pieces did she get?	8
Richard lives in a 15-story apartment building. On each floor, there are 8 units and 3/4 of the building is occupied. What is the total number of unoccupied units in the building?	30
Lloyd has a poultry farm. The chickens lay 252 eggs a day and he sells them for $2 a dozen. How much does Lloyd earn per week from selling eggs?	294
Tom's boat can travel 10 miles per hour. Tom sails from 1 p.m. m. until 4 p.m. m. On the way back, she cruises at a speed of 6 mph. How long does it take you to return?	5
Uriah's book bag is getting too heavy for him. He needs to get 15 pounds out of himself. His comic books weigh 1/4 pound each and his toys weigh 1/2 pound each. If he takes out 30 comic books, how many toys should he take out?	15
A mechanic charges different rates to repair truck and car tires. For each truck tire he repairs, the mechanic will charge $60 and for each car tire he repairs, the mechanic will charge $40. On Thursday, the mechanic repairs 6 truck tires and 4 car tires. On Friday, the mechanic repairs 12 car tires and no truck tires. How much more income did the mechanic make on the day with the highest income?	40
The Doubtfire sisters are driving home with 7 kittens they adopted from the local animal shelter when their mother calls them to let them know that her two house cats just had kittens. She tells them that Patchy, the first cat, has had three times the number of adopted kittens, while Trixie, the other cat, has had 12. How many kittens does the Doubtfire family have now?	40
Jean has 30 palettes. Jean eats 2 of the popsicles. With the leftover popsicles, Jean wants to pack 2 popsicles in a bag. How many bags can Jean fill?	14
Peter plans to go to the movies this week. He always buys a $7 entree and $7 popcorn. If he has 42 dollars for the week, how many times can he go to the movies?	3
A wooden bridge cannot support more than 5000 pounds. A delivery truck filled with identical boxes, each weighing 15 pounds, will cross the bridge. The combined weight of the driver and empty truck is 3,755 pounds. What is the maximum number of boxes that can be loaded on the truck without exceeding the weight limit of the bridge?	83
Stephen placed an online grocery order. The final bill was $40.00. Since the order was placed through a delivery service, they added a 25% fee to the final total and charged $3.00 for shipping. Stephen also added a $4.00 tip. After extra fees, what was the final price of Stephen's grocery purchase?	57
A raspberry bush has 6 clusters with 20 fruits each and 67 individual fruits scattered across the bush. How many raspberries are there in total?	187
A basket contains 25 oranges, of which 1 is bad, 20% are unripe, 2 are sour, and the rest are good. How many oranges in good condition are there?	17
Janet buys a brooch for her daughter. She pays $500 for the material to make it and then another $800 for the jeweler who will make it. Then she pays 10% of the total to insure it. How much did she pay?	1430
If Marcy works for the same company for 40 years, she receives an annual pension of $50,000/year. From the age of 20, she is entitled to 5% of the pension value per year. If she resigns after 30 years, what will be her annual pension?	25000
Aleena subscribed to a streaming service that charges her $140 per month. If the streaming company charged her the initial amount for the first half of the year and then charged her 10% less money in the other half of the year, calculate the total amount she will have paid at the end of the year for the streaming service .	1596
Sophia is thinking about taking a road trip and would like to know how far she can travel on a single tank of gas. She has driven 100 miles since she last filled the tank and she had to put 4 gallons of gas in it to refill it. The owner's manual for her car says that the tank holds 12 gallons of gasoline. How many miles can Sophia drive on a single tank of gas?	300
Jim spends 2 hours watching TV and then decides to go to bed and read for half of that time. He does this 3 times a week. How many hours does he spend watching television and reading after 4 weeks?	36
There are four schools competing in a basketball tournament. Each school has sent a women's basketball team and a men's basketball team, and each team is made up of 5 players. Additionally, each school has sent a coach for each team. In total, how many people have all the schools sent?	48
A treasure hunter found a hidden chest full of gems. There were 175 diamonds, 35 rubies less than diamonds and twice as many emeralds as rubies. How many gems were in the chest?	595
At Dr. Wertz's school, there are twice as many boys as girls. If there are 60 girls and 5 students for each teacher, how many teachers are there?	36
Bailey starts with a certain amount of money. Then, she receives a weekly allowance of $5 for 8 weeks. If at the end of the 8 weeks she has $100 total, how much money did Bailey start with?	60
Judy teaches 5 dance classes, every day of the week and 8 classes on Saturdays. If there are 15 students in each class and she charges $15.00 per student, how much money does she collect in 1 week?	7425
Kelian has two recipes for preparing dishes: one has 20 instructions and the second has twice as many instructions as the first. How many instructions does Kelian have to read to prepare the two dishes?	60
Tommy is raising money for his charity by selling brownies for $3 a slice and cheesecakes for $4 a slice. If Tommy sells 43 brownies and 23 slices of cheesecake, how much money does he make?	221
Shiela bought five cell phones for $150 each, in 3 monthly installments. Interest of 2% will be charged on each unit. How much will Shiela pay each month for 3 months?	255
Artie has a flower stand at the Farmers Market. It sells three varieties of flowers: marigolds, petunias and begonias. She typically sells marigolds for $2.74 per pot, petunias for $1.87 per pot and begonias for $2.12 per pot. Artie doesn't have any change today, so he has decided to round up all prices to the nearest dollar. If Artie sells 12 pots of marigolds, 9 pots of petunias, and 17 pots of begonias, how much money will he make?	88
Luke spends his time at the beach building sand castles. He eventually notices that each floor of a sandcastle will have half the square footage of the level below. If he builds a 4-story sandcastle, with the top floor having an area of ​​16 square feet, what will be the average square footage of one story?	60
Cecilia just bought a new puppy. According to the vet, she has to feed the puppy 1 cup of dog food every day for the first 180 days. Then she has to feed the puppy 2 cups of dog food every day for the rest of her life. If a bag of dog food contains 110 cups, how many bags of dog food will Cecilia use during the first year?	5
If Raymond does half as much laundry as Sarah, and Sarah does 4 times as much laundry as David, calculate the difference in the amount of laundry that Raymond and David do if Sarah does 400 pounds of laundry.	100
Vincent can purchase flowers in 3-pack bouquets for $2.50 or in 2-pack bouquets for $1. How much money does he save if he buys 18 flowers at the best price?	6
John adopts a dog. He takes the dog to the groomer, which costs him $100. The hairdresser offers you a 30% discount for being a new customer. How much does the hairdressing service cost?	70
Two girls each received 1/6 of the 24 liters of water. Then one child received 6 liters of water. How many liters of water were left over?	10
Charlie had 10 stickers. She bought 21 stickers at a store in the mall and they gave her 23 stickers for his birthday. Charlie then gave 9 of the stickers to her sister and used 28 to decorate a greeting card. How many stickers does Charlie have left?	17
Grace weighs 125 pounds. Alex weighs 2 pounds less than 4 times Grace's weight. What are her combined weights in pounds?	623
They plant 3 rose bushes. Each rose bush has 25 roses. Each rose has 8 thorns. How many thorns are there in total?	600
An American football team played 22 games. He won 8 more than he lost. How many games did he win?	15
Gene is sewing a quilt out of old t-shirts he brought back as souvenirs. He has a t-shirt from every vacation he has taken. Each t-shirt is a quilt block. Each row is made of blocks from different holiday years. Gene goes on vacation four times a year and has done so since he was 23 years old. He now has 34. How many quilt blocks does he have in total?	44
Greg has set an alarm that goes off three times a day as a reminder. When the alarm goes off, it keeps ringing until Greg turns it off. The first time he activated today, it rang four times. The second time he activated, it sounded three times louder than the first time. The third time, he rang half the time of the second time. How many times did the alarm sound in total?	22
A company pays each of its employees $600 a month. The company has a policy of increasing its employees' salaries by 10% of the starting salary each year for those who have been with the company for five years. If Sylvie just completed 5 years with the company last December, what is her annual salary after three more years of service?	9360
Marilyn's first album sold 10 times more copies than Harald's. If together they sold 88,000, how many copies did Harald sell?	8000
Christina is hosting a birthday party and needs 0.75 gift bags per guest because 1/4 of the attendees don't show up. She invited 16 friends. Gift bags are $2 each. How much will she spend?	24
Ted the Tyrannosaurus was planning to bring potato salad to the dinosaur picnic. He knows that an adult dinosaur will eat 10 pounds of potato salad and a child will eat half as much as an adult. If there will be 20 adults and 5 children at the picnic, how many pounds of potato salad should Ted bring to the picnic if he expects it to be enough for everyone?	225
Jan has three times as many pets as Marcia. Marcia has two more pets than Cindy. If Cindy has four pets, how many pets do the three of them have in total?	28
Emily has 4 children named Amy, Jackson, Corey and James. Amy is 5 years older than Jackson and 2 years younger than Corey. If James is 10 years old and 1 year younger than Corey, how old is Jackson?	4
Lee could previously run the 400-meter steeplechase two seconds faster than Gerald. But Gerald changed his diet, which improved his speed by 10%. If Lee runs the 400-meter steeplechase in 38 seconds, how many seconds faster can Gerald run it thanks to his improved diet?	36
In a neighborhood, the number of domestic rabbits is twelve less than the combined number of dogs and cats. If there are two cats for every dog ​​and the number of dogs is 60, how many total pets are there in the neighborhood?	348
Of the 200 5th grade students, 2/5 are boys, and 2/3 of the girls belong to the girl scout group. How many girls are not in the girl scout group?	40
Harry slept 9 hours last night. His friend James slept only 2/3 of what Harry slept. How many hours more than James did Harry sleep?	3
When Freda makes sauce with canned tomatoes, they lose half their volume. Each 16-ounce can of tomatoes she uses has three tomatoes. In the last batch of tomato sauce, Freda made 32 ounces of sauce. How many tomatoes did Freda use?	12
A line of cars formed on the highway. Some of the cars pass in the first 15 minutes of the traffic jam, then 20 more cars pass in the remaining 15 minutes of the traffic jam. 5 cars in the line take an exit to avoid having to go through the traffic jam. If there were originally 30 cars on the highway, how many cars passed through the traffic jam in the first 15 minutes?	5
Mary is an avid gardener. Yesterday, she received 18 new potted plants from her favorite nursery. She already has 2 potted plants on each of the 40 window sills of her large country house. Since she is generous, she has decided that tomorrow she will give 1 potted plant from each shelf to friends and family. How many potted plants will Mary have left?	58
Jerome had 4 friends who came to visit him on a certain day. The first friend rang the doorbell 20 times before Jerome opened the door, the second friend rang the doorbell 1/4 as many times as the first. The third friend rang the doorbell 10 times more than the fourth. If the fourth friend rang the doorbell 60 times, how many times did the doorbell ring?	175
You only have to read 4 pages of the science book, 20 pages of the social science book, 7 pages of the history book and 8 pages of the geography book. He only read 15 pages on Monday. If you have 4 more days to complete all the reading, how many pages should you read, on average, in one day?	6
John likes to have a glass of water with breakfast, lunch and dinner. Lastly, he also takes one before going to bed. John does this every day of the week, but on the weekends, he likes to relax and have a soft drink with dinner. How many glasses of water does John drink in a week?	26
A fog bank enters from the ocean to cover a city. It takes 10 minutes to cover 3 miles of the city. If the city extends 42 miles from the seashore to the opposite inland bank, how many minutes will it take for the fog bank to cover the entire city?	140
Poppy is putting together a 1000 piece puzzle. He places a quarter of the pieces on the board, then his mother places a third of the remaining pieces. How many pieces of the puzzle are left to place?	500
Cody eats three times as many cookies as Amir. If Amir eats 5 cookies, how many cookies do the two of them eat together?	20
John has 3 boxes. Each box is 5 inches by 6 inches by 4 inches. The walls are 1 inch thick. What is the total interior volume of the 3 boxes?	72
Every night, Frankie watches television after finishing his homework. On Monday and Tuesday, she watched a 1-hour episode of his favorite show each night. On Wednesday, she watched a few episodes of a 30-minute show. On Thursday, he finished homework early and watched a 1-hour episode and a 30-minute show. On Friday, he stayed up late for the weekend and watched two 1-hour episodes. If he watched 7 hours of television in total, how many 30-minute episodes did he watch on Wednesday?	3
Henry is making cookies for a local baking competition. He wants to do twice as much as he did last year. When he finishes baking, he realizes that he actually baked 15 more cookies than he wanted. When he sets them to cool, he discards 5 of the cookies and now has a total of 110 cookies. How many cookies did Henry bake last year?	50
