A classroom has a whiteboard shared between the 4 teachers who take turns using the room. Each of them gives 2 lessons per day and uses the whiteboard each time. If the board is cleaned 3 times per lesson, how many times is it cleaned in a day?	24
Every day, Ryan plants 2 flowers in his garden. Knowing that 5 flowers have not grown, how many flowers will he have after 15 days?	25
Jamal's phone can store 6 times more photos than Brittany's. Brittany's phone can store at most 50 times more than there are birds in the photo Jamal took of ducks in the zoo. If Jamal's phone has a capacity of 1,800 photos, how many ducks can be seen in the photo he took?	6
Some time after purchasing lumber, Sasha notices that prices have increased by 50% in recent months. She therefore decides to sell the wood she has left. He has ten 2 x 4 x 10 boards left, which cost him $10 each. She also has five 4 x 4 x 10 boards that she purchased for $16 per board. If she manages to sell them all, what will be her profit?	90
Katy brews coffee using teaspoons of sugar and cups of water in a ratio of 7:13. Calculate the number of teaspoons she poured, knowing that she used a total of 120 spoons teaspoon of sugar and cups of water.	42
For each of his 3 children, Jean buys 2 pairs of shoes worth $60 each. How much did he pay?	360
A customs officer at SeaSide's main clearing port counted 2 containers of imported vehicles, each with 5 vehicles inside. The following day, new containers arrived and brought the total number of vehicles in the port to 30. Calculate the number of containers imported on the second day, assuming that all containers contain 5 vehicles.	4
Adrien's total salary was 30% more than Lylah's. Four years later, his salary had increased and was 40% higher than what he was initially earning. If Adrian's and Lylah's salaries increased simultaneously, and Adrian earned $40,000 four years ago, calculate the total amount of both of their salaries four years later.	95200
Miguel uses 2 boxes of paper per week for his drawing. If each box contains 30 sheets of paper, how many sheets of paper does he use per month?	240
Morisette and Kael were asked to bring fruit. Morisette brought 5 apples and 8 oranges, while Kael brought twice as many apples and half as many oranges as Morisette. How much fruit did they bring in total?	27
Sadie slept 8 hours on Monday. She slept 2 hours less each of the next two days, due to certain obligations. Knowing that the rest of the week she slept 1 hour more than on these two days, how many hours did she sleep in total during the whole week?	48
Rosie runs at a speed of 10 miles per hour for 3 hours. Then she runs 5 miles per hour. How many miles will she have traveled in 7 hours?	50
Jennie helps out at her mother's office. It has a stack of 60 letters to stamp and another with letters already stamped. She stamps a third of the letters to be stamped. If there are now 30 letters in the pile of stamped letters, how many were there in the pile when Jennie started the job?	10
Julia was preparing for a dinner party at her home, during which she planned to serve stew. She noticed she was out of plastic spoons so she bought a new pack of spoons. Later, her husband also bought a pack of 5 new spoons and gave them to Julia. While cooking, Julia used three spoons to taste her stew. Later, when she went to set the table, she had a total of 12 spoons. How many spoons were in the package Julia bought?	10
Dylan needed some chicken sausages and fish sausages to make sausage rolls at a party. He bought 38 more chicken sausages and 6 more fish sausages than there was chicken. How many sausages did Dylan buy in total?	82
After transferring to a new school, Amy made 20 more friends than Lily. If Lily made 50 friends, how many friends do Lily and Amy have in total?	120
Well's mother sells watermelons, peppers and oranges at the neighborhood store. A watermelon costs three times more than a pepper and an orange 5 times less than a watermelon. Dillon is sent to the store to buy 4 watermelons, 20 peppers and 10 oranges. What total amount will he spend if each pepper costs $15?	880
A hospital admits 500 people per day. Each patient is examined for an average of 24 minutes. Doctors charge the hospital $150 per hour and the hospital charges patients $200 per hour. How much profit does the hospital make from these consultations?	10000
Nissa hires 60 seasonal workers to play elves in the Santa Claus village of her department store. A third of the elves quit after kids vomit on them, then 10 of the remaining elves quit after kids kick them in the shin. How many elves are left?	30
In May, Joseph's expenses totaled $500. They fell by $60 in June. What is the sum of expenses incurred during the two months?	940
Pam and Fred went to a funfair. Pam went on the roller coaster twice and Fred 4 times. Then each of them went sledding twice. If each ride costs 6 tickets, how many tickets did they use that day?	60
On Monday, Walt walked 4 miles. On Tuesday, he walked 6 times as many miles as on Monday. His mileage from Monday to Wednesday was 41 miles. How many miles did he walk on Wednesday?	13
Tom does 4 car washes per month. If each wash costs $15, how much does he spend in a year?	720
Brian's friend Bobby owns 5 fewer video games than 3 times Brian's amount of video games. If Brian owns 20 video games but lost 5 just before the beginning comparison, how many does Bobby own?	40
There are only 27 unicorns left in the world. A third of them are in the Highlands, Scotland. Two thirds of Scottish unicorns are female. How many Scottish unicorns are there?	6
Rory orders 2 subs for $7.50 each, 2 packages of fries for $1.50 each, and 2 cookies for $1.00 each. A 20% delivery fee is charged at checkout and Rory adds a $5.00 tip. How much will your delivery order cost?	29
Yesterday, Marc took a 75-question test. He went through it at a rate of 5 questions per hour. Today he took another 100-question test at the same rate. If Marc took 8 hours to do the first test and 6 hours for the second, how many questions remained unanswered?	105
In a candy dispenser, there are 22 times as many blue gumdrops as four times the amount of pink gumdrops. If there are 12 blue gumballs, how many pink gumdrops are there?	70
Among the 20 rental cars available, 12 are automatic cars, 4 are manual cars and the rest are semi-automatic cars. What is the percentage of semi-automatic cars?	20
A hive has 700 bees. There are twice as many worker bees as baby bees and twice as many babies as queens. How many worker bees are there?	400
Jordan spends 2 hours a day playing video games. He also has a part-time job that pays him $10 an hour. How much money would Jordan make in a week, if his playing time was spent working?	140
John buys $2 worth of milk, $3 worth of eggs, $3 worth of light bulbs, $3 worth of cups and $4 worth of cockroach traps. Knowing that a 10% tax applies to all non-food items, how much did all of this cost.	16
Kim has created his own maintenance company and is calculating the profit he can make from his customers. He already has 3 clients, but his discussion with 5 other potential clients makes him confident enough to include them in his calculations. 2 bottles of bleach and a pack of rags will be necessary to maintain each client's house. You will have to pay $2 per bottle of bleach and $5 per pack of rags. These are his only expenses. He calculates that his total income each week will be $92. Since profit is the difference between total income and total expenses, how much profit, in dollars, will Kim make each week?	20
Jean owns a 10 hectare pineapple field. Knowing that there are 100 pineapples per hectare and that John harvests them every 3 months, how many can he harvest in a year?	4000
Johnny picks up the toys lying around his room. He dropped a Lego set of 500 pieces, another with 3 times as many pieces, as well as a final one with 1/4 the number of pieces. How many coins does Johnny collect in total?	2,125
Debra monitors a hive to see how many bees come in and out in a day. She sees 30 bees leave the hive in the first 6 hours, then sees half of them return in the next 6 hours. Then, over the next 6 hours, she sees twice as many bees fly away as those who left the hive the first time. Then, during the next 6 hours, all the bees that had gone out and had not yet returned return to the hive. How many bees did Debra see return to the hive in the last 6 hours of the day?	75
Brittany and her mother go to the museum. Admission is $12 for adults and $10 for children. Brittany's mother gives the cashier money for 1 child ticket and 1 adult ticket. If she received a difference of $8, how much money, in dollars, did she give the cashier?	30
Charlie has three times as many Facebook friends as Dorothée. Jacques has four times more than Dorothée. If Charlie has 12 Facebook friends, how many does Jacques have?	16
Steve and Tim decide to see who can get home from school the fastest. Steve lives further away than Tim and therefore has the right to use his bike. Steve lives 3 miles from the school and pedals at 440 feet per minute. Tim lives 2 miles from the school. If Tim rides a skateboard at a speed of 264 feet per minute, how long will the winner wait at home before the loser finishes the race?	4
Shawnda thinks a bike inflation service would be very helpful to the children in her neighborhood. She chooses to charge by the tire. Inflating each tire costs 25 cents. The first day, 5 people came to inflate the two tires on each of their bikes. 3 people came to inflate all the tires on their tricycles. Finally, a person came on a unicycle. How much money did she make that day?	5
Carl buys ten packages of cookies. Each package contains six cookies. Each cookie costs $0.10. How much change does Carl get if he pays with a $10 bill?	4
Dave bought a big bag of fries and ate fourteen of them before a hungry seagull stole the bag from his hands. When the seagull landed, it gobbled up half the amount of fries Dave had eaten. Then three pigeons forced the seagull away from the food and each of them got to eat three fries. Later, a raccoon stole two-thirds of the remaining fries. The ants took one last one, leaving five fries behind. How many fries were in the package when Dave bought it?	48
On Mondays, Wednesdays and Fridays, student Kimo has three one-hour classes per day. On Tuesdays and Thursdays he has two 2-hour classes each day. If there are 16 weeks of school per semester, how many hours does Kimo spend on classes during a semester?	272
Every day, Bill prepares 300 rolls, 120 chocolate croissants and 60 baguettes. The rolls are 4 inches each, the croissants are 6 inches each, and the baguettes are two feet each. If Bill places all the baked goods end to end, how long will they be in feet?	280
To feed the zoo's monkeys, the keeper orders bananas from a local farm every 2 months. If you need 200 bananas for the macaques, 400 for the gorillas and 100 for the baboons, how many should you order to last for the 2 months?	1400
Blake and Kelly compete to see who can run the most in 15 minutes. They decide to do it on a 100 yard long football field. Blake goes back and forth 15 times. Kelly goes back and forth, then decides she doesn't want to run alongside Blake. She therefore begins to go back and forth, limiting herself to the 40 yard line. She does it 34 times. How many more yards did the winner run than the loser?	80
Raphael went to buy school supplies. He bought 4 pens for $1.5 each, 2 notebooks for $4 each and bond paper for $20. How much did Raphael spend on all this?	34
Finn observes 11 tadpoles swimming in the pond. He suddenly sees 6 come out from under a water lily, then 2 hide under a rock. How many tadpoles can Finn see in the pond now?	15
A water reservoir is 17 feet deep on Monday. On Tuesday, the reservoir held 7 feet more water. On Wednesday, the water depth is two-thirds of what it was on Tuesday. How deep is the water in the reservoir on Wednesday?	16
Anakin and Locsin went to the beach today. Anakin caught 10 starfish, 6 seahorses and 3 clownfish. Locsin caught 5 fewer starfish than Anakin, 3 fewer seahorses than Anakin, and 2 more clownfish than Anakin. How many fish did they both catch?	32
If a bag of marbles costs $20 and the starting price increases by 20% every two months, how much will a bag of marbles cost after 36 months?	92
Several toys are placed in a room: 5 red cars, 3 figurines and a doll. The doll costs the price of all 3 figures, and a red car costs $4. Knowing that a figure costs $5, what is the total value of the toys?	50
Jackie wonders whether she should file her taxes herself or hire an accountant. By doing it herself, she will be able to do 3 fewer hours of freelance work, which represents a loss of $35 per hour. The accountant asks him for $90. How much more money will she have if she hires him?	15
For her 30th birthday, Elvira chose a new computer with many accessories as a gift. She has a budget of €1,500 donated by her whole family and thinks she will be able to keep a little to buy herself a piece of clothing. She goes to a computer store and chooses a device that costs €1090 with a screen, keyboard and mouse. She also buys a scanner for €157, a CD burner for €74 and a printer for €102. How much money will he have left for his clothes?	77
Sandra's neighbor gives her a basket of 9 eggs every time she babysits her daughter. To make a Spanish flan, Sandra needs 3 eggs. If she was tasked with making 15 cream cakes for her school's fundraiser, how many times should she babysit the child?	5
Seth is twice as old as Brooke. In two years, the sum of their ages will be 28 years. How old is Seth?	16
Jimmy has $2 more than double Ethel's money. If Ethel has $8, how much money does Jimmy have?	18
Aside from weekends when he walks 10 miles, Pancho does 20 miles every day. How many miles does he walk in a week?	120
The marching band orders new uniforms. Each uniform includes a hat that costs $25, a jacket three times more expensive than the hat, and pants that cost the average of the hat and jacket prices. What is the total cost of each uniform?	150
Jake walks through the entomology museum. He sees 80 8-legged spiders, 90 6-legged insects, and 3 rare 10-legged mutant invertebrates. How many legs does Jake see in total?	1210
There are four birds at the Caboose. Sally Two is three years older than Granny Red. Granny Red is twice as old as Sally Four. If Sally Four is the same age as Sally Thirtytwo, and Sally Thirtytwo is 8 years old, what is the total age of the four birds?	51
Jessica wonders how much money she has to pay each month to cover all her debts. The minimum payment on his student loan is $300 per month, the minimum payment on his credit card is $200 per month and the minimum payment on his mortgage is $500 per month. If Jessica wants to pay 50% more than the minimum, how much must she pay in one year?	18000
Billy peels and dices potatoes to make potato salad for his big family barbecue. As it is an important event, he has 60 potatoes to peel. The potatoes are about the same size, so it takes about the same time to peel and cut them. It takes Billy about a minute and a half to peel a potato, but only 5 seconds to cut it. How long does it take Billy to finish preparing the potatoes?	95
Juan and his brother Carlos sell lemonade. For every gallon they spend $3 on lemons and $2 on sugar. They get 20 glasses of lemonade and sell them for $0.50 per glass. If they made a profit of $25, how much did they spend on the lemons?	15
In a race involving 240 Asians, 80 of them were Japanese and the rest Chinese. If the number of boys on the Chinese team was 60, how many girls were there on the same team?	100
Zaid spends 1/4 of his salary on rent, 1/3 on fuel for his car and donates half of the remaining amount to his favorite charity. He gives $200 to his daughter for her weekly expenses and $700 to his wife for groceries and other household items. If Zaid makes $6,000 a month, how much money will he have left after all these expenses and donations?	350
Rani has ten more crabs than Monique, who has 4 less crabs than Bo. Knowing that Bo has 40 crabs, calculate the total number of crabs.	122
Lloyd earns $10 an hour giving private math lessons. He gave 5 hours of lessons the first week and 8 hours the following week. How much did he earn for the first two weeks?	130
Two candidates are running for the position of class representative at Sarai school. If the winner received 3/4 of the votes and the total number of students who voted was 80, calculate the number of votes obtained by the loser.	20
Sandra, the local florist, is very unhappy with Fred's incomplete delivery. Sandra had ordered four times as many red roses as white carnations. She also ordered 200 pink calla lilies, five times the quantity of white carnations. Sandra has threatened to change suppliers if the missing red roses are not delivered by 5 p.m. To keep Sandra as a customer, how many red roses must Fred deliver before 5 p.m.?	160
Jean is two years older than Marc. Two years ago, Marc was 5 years older than half Jan's age. If Jan is 30, how old is Jean?	23
Two track and field teams compete in a 4 x 400 meter relay, a race where each team has four members who each run 400 meters, or a standard lap of the track. One of the two teams is very well practiced and each of its members completes their 400 meters in exactly 55 seconds. The other team is less well established. His first runner does 400 meters in 60 seconds, then each subsequent runner is 3 seconds faster than the last. Based on this information, in how many seconds will the fastest team win?	2
Jerry rolls a six-sided die. What is the probability (in percentage) that he gets a number greater than 3 rather than an even number twice in a row?	25
Jenna and her mother picked apples on their farm. Jenna picked half as many apples as her mother. If her mother picked 20 apples, how many apples did she pick in total?	30
Russell works in a pet store and distributes straw to rodents. The rats are divided into 3 cages in groups of equal size and each rat receives 6 pieces of straw. There are 10 hamster cages. Each of them is alone in their cage and receives 5 pieces of straw. There is also a rabbit enclosure where 20 pieces of straw are distributed. No straws are used anywhere else in the store. If 160 pieces of straw were distributed to the small rodents, how many rats are there in each cage?	5
Mandy owes Benedict $100. They agreed on a monthly interest of 2%. If Mandy is able to pay this amount after 3 months, how much should she give Benoît?	106
A trader buys a few bags of wheat from a farmer for $20 per bag. Knowing that it costs $2 to transport one bag from the farm to the warehouse and that all the bags were sold for $30 per bag for a total profit of $400, how many bags did he sell?	50
Three friends spent $20.25 for 3 admission tickets to the fair. They also spent $4.50 less on food than they spent on tickets. They also did 2 rides at $33 per ride. If they agreed to split the costs equally, how much did each pay?	34
Jean picks peaches for 3 hours. He picks up 2 peaches per minute. How many peaches did he pick?	360
Ducks need to eat 3.5 pounds of insects per week to survive. How many pounds of insects does a flock of ten ducks need per day?	5
Tom plants 10 trees per year. He also cuts down 2 trees each year. It starts with 50 trees. After 10 years, 30% of trees die. How many trees does he have left?	91
Sue lives in a neighborhood where good humor reigns. During a certain weekend, the neighbors decided to play a prank on him. On Friday morning, they placed 18 plastic flamingos in his garden. On Saturday morning, the neighbors took back a third of the flamingos, painted them white and placed them back in Sue's garden. Then, on Sunday morning, they added 18 more plastic flamingos to the collection. At noon on Sunday, how many more plastic pink flamingos were there than white flamingos?	24
Violetta wants to buy new pencils. She needs it in 5 different colors and has budgeted $20 for this purchase. Knowing that a pencil costs $2, how much change will she have?	10
A pen costs as much as a pencil and eraser combined. If a pencil costs $1.20 and an eraser costs $0.30, what will be the price of 8 pens?	12
It is necessary to distribute 200 pounds of carrots to 40 restaurants in a certain city. If each restaurant is to receive 2 pounds of carrots, how many pounds of carrots will go unused?	120
In the town of Soda there are exactly 23,786 inhabitants. 8,417 of them are men and 9,092 are women. The rest of the population is made up of children. How many children are there in Soda?	6277
Initially, Elaine had 20 Pokemon cards. She collected three times as much after a month. In the second month, she collected 20 fewer cards than those collected in the first month. Finally, in the third month, she collected twice the total number of cards collected in the first two months. How many Pokemon cards does she have now?	320
Marc is a reviser. He reviews the same number of sentences each week for two different editors, each of whom pays him a different rate. Editor B pays Mark twice as much as Editor A. Mark edits a total of 1,000 sentences per week, while Editor A pays him 5 cents per sentence. How much does Mark earn in a week, in cents?	7500
Baldur draws water from a well. He gets 5 buckets in the morning and 6 buckets in the afternoon. If each bucket contains 5 liters of water, how many liters of water does it collect each day?	55
Jean receives an award at work. This award consists of a one-time bonus of $5,000 and a 5% salary increase. If he makes $2,000 a week, every week of the year, and he received the prize on the first day of the year, how much money did he make that year?	114,200
Josie grows grapes on her 10-acre farm. It produces 5 tons of grapes per year on each acre, and each ton of grapes produces 2 barrels of wine. How many barrels of wine does his farm produce per year?	100
Cheese is Carl's favorite food. He ate a sandwich every day of the week for lunch and used 2 slices of cheese in each sandwich. He ate cheese and egg omelets for breakfast 3 days a week, using one more slice per omelet than he used per sandwich. He made a large dish of mac and cheese for several dinners this week and used 8 slices of cheese in his preparation. How many slices of cheese did he use in total?	31
Janet had 22 green pens and 10 yellow pens. She then bought 6 bags of blue pens and 2 bags of red pens. Each bag of blue pens contained 9 and each bag of red pens contained 6. How many pens does Janet have now?	98
Brinley is in Mr. Bert's math class. The latter administers six tests per semester. It allows students to take the worst average from each semester. If, on the first five tests, Brinley received scores of 89, 71, 92, 100, and 86, what score must she obtain on the sixth test to have an average of 93?	98
Micheal loves cycling. He does it at least 5 times a week and does 25 kilometers each time. He did it for four weeks, then he decided to only do it twice a week, but covering 60 kilometers each time, which he did for 3 weeks. How many kilometers did Micheal do in total?	860
Joe's Halloween candy bag contains 25 chocolate bars and 80 candied apples. Each bar of chocolate weighs twice as much as a candied apple. If the chocolate bar weighs 40 g, what is the weight, in grams, of Joe's bag of candy?	2600
On Monday, Rose went to buy 4 cakes in a store. On Tuesday, she bought three times as many cakes from a different store. On Wednesday, she went to another store and bought 5 times the amount of cakes she bought on Tuesday. How many cakes did she buy in total during these three days?	76
Twenty dozen cups cost $1,200 less than the total cost of half a dozen plates which sold for $6,000 each. Calculate the price of a cup.	145
Sara wants to buy a new jacket and 2 pairs of shoes. The jacket she chose cost $30 and each pair of shoes cost $20. Sara babysits the neighbor's children 4 times and earns $5 each time. Her parents give her $4 every time she mows the lawn. If Sarah already had $10 in savings before she started babysitting, how many times does she have to mow the lawn before she can afford the jacket and shoes?	10
Jerry has a chicken farm. Red hens produce 3 eggs per day, and white hens 5 eggs per day. Jerry collects 42 eggs every day. If he has two more white chickens than there are red ones, how many red chickens does he have?	4
Gary likes to walk by the local park, which is shaped like a rectangle measuring 1.5 by 6 miles. If he walks at 3 miles per hour, how many hours of walking does he log?	5
At the dollar store, Sloane counts 100 customers entering the store. The next day, she had 50 more than the first day. If on the third day the total number of customers was 500, how many customers did she count that day?	250
Jerry has two swimming pools, both with leaks that drain them at a rate of 4 gallons per minute. 4 minutes ago, the big pool had twice as much water as the small one. Now she has four times as many. How much water is in the small pool now?	8
Lori wants to buy a pair of shoes for $320.00 and a matching belt for $32.00. Her part-time job earns her $8.00 an hour. How many hours will she have to work before she can make her purchases?	44
Janeth borrowed $2,000 and promised to return it with an additional 10% of the amount. If she has to pay $165 per month for 12 months, how much money will Janeth have left by then?	220
There are 4 roses in the vase and 7 more dahlias than there are roses. How many flowers are there in total in the vase?	15
Adrian's age is three times that of Harriet, who is half Zack's age. Calculate the average age the three will be in three years, if Harriet is currently 21 years old.	45
