Four students scored a total of 251 points in a board game. Naomi scored 68. Yuri scored 10 more points than half of Naomi's, and Brianna scored 17 more than Naomi. How many points did Jojo score?	54
It takes Carmen 10 minutes to finish a crossword puzzle and 5 minutes for a sudoku puzzle. During the weekend, she solved 3 crossword puzzles and 8 sudoku puzzles. How much time did she spend playing these games?	70
A water tank holds 120 liters of water. Céline used 90 liters of it to water her small garden. She was then able to collect rainwater which is twice as much as what was left. How many liters of water are there in the tank now?	90
Andy plants 90 fewer geraniums and 40 petunias than geraniums. How many flowers does he plant in total?	140
A company spends $15,000 on advertising for one year, then spends a third of that on advertising for another year. What is the total amount the company spent on advertising during these two years?	20000
Carlos and Benji are at the beach. Carlos rents a canoe for $30 an hour and Benji rents a banana boat for $18 an hour. If Carlos uses his boat for 3 hours and Benji his for 5 hours, how much will the total amount of their rentals be?	180
Andre is planning a road trip from New Jersey to Rochester. It takes him 6 days to travel by bus and half that time to travel by car. How many days of travel will it take him if he plans to go to Rochester by bus and return by car?	9
James counts his Pokemon cards. It has 30 fire type, 20 grass type, and 40 water type. If he loses 8 water-type cards and buys 14 grass-type cards, what is the percentage chance (rounded to the nearest whole number) that a randomly chosen card is water-type?	33
For his lunch, Chad ordered a build-your-own burrito. The basic burrito costs $6.50. It adds $2 meat, $1.00 cheese, $1.00 avocado and 2 sauces at $0.25 per sauce. He chooses the premium option for $3.00 more, which allows him to add fries and a drink. He has a $5.00 gift card that he uses at checkout. How much does he have left to pay?	9
Kalinda attempts to complete a 360-piece puzzle with her mother. She is capable of placing 4 coins per minute. His mother places half as much per minute. How many hours will it take them to complete this puzzle?	1
A watermelon farm produced 120 baby watermelons. Ashlyn visited the farm after two months and found that 30% of the watermelons were ready to harvest so she took them home. When she returned two weeks later, 3/4 of the remaining watermelons were ready, and she harvested them. How many watermelons were not yet ready for harvest after those two weeks?	21
Marc buys a fleet of 12 cars for his business. Each car sells for $20,000. He pays 10% tax on cars, then another $1,000 to register each one. How much does he spend in total?	276,000
Kylie and Robert like to go collecting shells at the beach. On Monday, Kylie collects 5 more shells than Robert, who collects 20. On Tuesday, Kylie collects twice as many shells as she collected on Monday. How many seashells did Kylie collect on Tuesday?	50
Dax went to pick apples at the farm and found half as many insects as ants in the garden. If there were 50 ants, calculate the total number of insects in the garden.	75
There are 36 penguins sunbathing in the snow. A third of them dive and swim in the ocean. Another third goes inside the cave to eat their dinner. How many penguins continue to sunbathe?	12
Steve now wants to eat more tomatoes and decides to grow his own cherry tomatoes. He eats twice as much as his girlfriend at a rate of 6 per day. Knowing that a vine produces 3 tomatoes per week, how many vines will it need?	21
John orders pizzas to share with his friends. There are 20 friends in total, and John wants to make sure that everyone gets 4 shares. If pizzas are only sold cut into 8 slices, how many pizzas should John order?	10
Ram uses many pens. He discovered he could save money by mixing the ink from five empty pens to make one full pen. If he buys 25 pens that he uses to make new pens when the ink runs out, how many pens will he get in total?	31
Johnny took his $20 allowance, to which he added $10. He then invested this sum, which tripled in one year. How much money did he have after a year?	90
Mary is two years younger than Jeanne, who is five years older than Jessa. If Jessa is 20 years old, what is the sum of the ages of the three girls?	68
A school building houses 1,000 students. This building has 3 entrances A, B and C, which also serve as exits. If, after a meeting, 30% of the students exit the building through exit A, 3/5 through exit B, and the rest through exit C, calculate the number of students who took exit C.	280
Jacques has 6 more candies than Robert. Jean has twice as many as Robert. If John has 54 candies, how many more candies does he have than Jack?	21
Dolly has two books. Pandora only has one. If Dolly and Pandora read each other's books as well as their own, how many books will they have read in total by the end?	6
Mike was a pen pal for 5 people and then stopped corresponding with 2 of them. The others each send 2 letters of 5 pages every week. He answers them the same way. If he can write a page every 6 minutes, how many hours does he spend writing per week?	3
Jason has a phone plan of 1,000 minutes per month. Every day he communicates with his boss for 15 minutes and this month he spent 300 minutes of additional calls to other people. How many minutes does Jason have left if this month has 30 days?	250
Griffin had 24 fries but Kyle took 5. Billy took twice as many as Kyle. Ginger gave Griffin a handful of her fries, then Colby took 3 fewer fries from Griffin than Kyle took. If, in the end, Griffin had 27 fries, how many fries did Ginger give Griffin?	20
There are 4 snails in one aquarium and 32 in another. The difference between the quantities of snails in the two aquariums is equal to twice the sum of the fish in the two aquariums. If both aquariums contain the same number of fish, how many fish are in each aquarium?	7
Jeanne's makeup artist charges her $250 an hour. She needs very expensive makeup for a movie she's starring in and it takes her 6 hours a day. She has to do it 4 times a week. The film lasts 5 weeks. After the film is finished, the makeup artist gives Jane a 10% discount because of the amount of work done. How much did Jane pay?	27000
Isabelle bought supplies for her little sister's birthday party. She spent $12 on cake ingredients, $43 on birthday gifts, $15 on decorations, $4 on invitations and $22 on goodie bags for guests. She split the cost three ways, between herself and her two parents. How much did each person pay?	32
A chef bought 4 bags of onions, 50 pounds each. If a pound of onions cost $1.50, how much did he spend?	300
On Monday, Sue ate 4 times as many cookies as her sister. On Tuesday, she ate twice as much as her sister. Her sister ate 5 cookies on Monday and ate 13 the next day. If 1 cookie contains 200 calories, how many more calories did her sister Sue consume?	5,600
