Steve decided to start eating more tomatoes and decided to grow his own cherry tomatoes, which he surprisingly ate twice as much as his girlfriend, eating six tomatoes a day.	21
John ordered a pizza to share with his friends, who were 20, and John wanted to make sure that each of them would get four pieces, which would be sold in eight pieces.	10
Ram was a pen user, and he found that he could save money by combining five empty pens into one full pen. If he bought 25 pens and brought them back to make new pens when the pen was almost out, how many pens would he have?	31
Johnny took out $20 of his alimony and added another $10 and then he put it into an investment, which tripled in one year, so how much money did he have after one year?	90
Mary is two years younger than John, and John is five years older than Jessica. If Jessica is 20, how old are all three women combined?	68
In a school auditorium with 1,000 students, there are three entrances, A, B and C, which are also used as exits. If after the meeting, 30% of the students leave the building using exit A, the remaining three-fifths exit B, and the rest exit C, then calculate the number of students who leave the building using exit C.	280
James has six more apples than Robert, and John has twice as many apples as Robert.	21
Dolly has two books, Pandora has one book, and if Dolly and Pandora both read each other's books, including their own, how many books would they end up reading together?	6
Mike had five pen pals, and then he broke off the pen pals with those two, and each of the other guys sent him two letters a week, five pages each, and he wrote back in a friendly way, and he could write a page every six minutes, and he would write for how many hours a week.	3
Jason has a package of 1,000 minutes of phone calls a month, where he's going to talk to his boss for 15 minutes a day, and then spend 300 minutes of this month talking to other people.	250
Griffin had 24 fries, but Kyle had five, and Billy had twice as many as Kyle, and Ginger had a handful of fries for Griffin, and Colby had three fewer fries than Griffin, and if Griffin had 27 fries, then how many fries did Ginger have for Griffin?	20
In one tank, there are four trawlers, and in the other tank, there are 32 trawlers, and the difference between the number of trawlers in two tanks is twice the number of fish in both tanks, if the two tanks have the same number of fish, each tank has two fish.	7
A Chinese makeup artist was paid $250 an hour, and she had to wear expensive makeup to get into the movie she was in, which took six hours of makeup a day, and she had to do it four times a week, and the movie was shot in five weeks.	27000
Isabel bought her little sister's birthday party, where she spent $12 on the cake, $43 on the birthday present, $15 on the decorations, $4 on the invitation cards, and $22 on the hospital bags for the guests who came to the party. She split the cost with her parents, three of them, equally. How much did each of them pay?	32
The chef buys four bags of dumplings, each bag weighing 50 pounds, one pound of dumplings for $1.50.	300
On Monday, Sukin eats four times as many cookies as her sister, on Tuesday, she eats twice as many cookies as her sister, and her sister eats five cookies on Monday, and 13 cookies on the next day.	5,600
