Janet's duck lays 16 eggs a day, she eats three eggs for breakfast every day, and she uses four eggs to make a muffin for her friends every day, she sells the rest of the eggs at the farmers market every day for $2 per pound of fresh duck eggs, how much money does she make from the farmers market per day?	18
A robe is made of two strips of blue cloth and half of the white cloth is made of blue cloth. How many strips of the same cloth are there in a robe?	3
Josh decided to try to buy the house to fix it up for resale, so he bought it for $80,000 and spent $50,000 on the renovation, which increased the value of the house by 150%.	70000
James decided to run three sets of short runs three times a week, running 60 meters each set, and how many meters did he run in a week?	540
Wendy feeds her chickens regularly every day with three bowls of chicken feed, each consisting of seeds, worms and vegetables to help her chickens stay healthy, she divides the feed into three meals, in the morning she feeds 15 bowls, in the afternoon she feeds another 25 bowls, if Wendy's chickens in the coop have a total of 20, how many bowls should she feed the chickens in the last meal of the day?	20
So, Claire goes to the store to buy glasses for her new apartment, and one glass costs $5 but the second glass will only cost 60% of the full price.	64
Toulouse has twice as many sheep as Charleston, Charleston has four times as many sheep as Seattle, if Seattle has 20 sheep, how many sheep do Toulouse, Charleston and Seattle have combined?	260
Carla is downloading a 200 GB file, normally she can download 2 GB/min, but after 40% of the download, Windows is forced to restart and install the update, which takes 20 minutes, then Carla has to start downloading the file again from the beginning.	160
John spent three hours driving at 60 miles an hour, then turned back because he remembered he had forgotten something very important at home. He tried to get home in four hours, but the car hit the stop sign for the first two hours. Half an hour later, he drove at 30 miles an hour, before reaching 80 miles an hour for the remaining four hours. At the end of the four hours, he was still how many miles away from home?	45
Elisa's hourly rate for the first 40 hours of work each week was $10 and she was paid overtime at 1.2 times her regular hourly rate. If Elisa worked 45 hours this week, her earnings for this week would be $1.	460
The new program, one of the programs, had 60 downloads in the first month, the second month's downloads were three times higher than the first month's, but the third month's downloads were down 30 percent.	366
She went to a bakery and bought a bunch of bread, she bought three doughnuts for $68 a can, two cupcakes for $80, and six cupcakes for $55.	694
Carlos grew a lemon tree for $90. The lemon tree would produce seven lemons a year, which he could sell for $1.50 a lemon. The cost of watering and fertilizing the lemon tree was $3 a year.	13
Melanie is a door-to-door salesperson, and she sold one-third of the vacuum cleaners in the green house, sold two more in the red house, and sold half of the remaining number in the orange house.	18
A dance class, which is 20 students, 20 percent of the students are in contemporary dance, 25 percent of the students are in jazz, and the rest of the students are in hip-hop, and the hip-hop is the percentage of the students.	60
A trader has to choose between two plans: jewelry for $5,000 or electronics for $8,000. His financial advisor estimates that the jewelry market will increase in value by 2.5% and the electronics market will increase in value by 1.2% within the same month. If the trader wants to choose the most profitable plan by the end of the month, how many dollars will the trader make?	125
Two trains leave San Rafael at the same time, both trains start heading west for 80 miles, the next day both trains head north for a combined 150 miles.	230
Jill is paid $20 an hour as a teacher and $30 an hour as a cheerleading coach, so if in a year she works 50 weeks, 35 hours a week as a teacher and 15 hours a week as a coach, she's going to make four dollars a year.	57500
Claire makes three egg omelets for breakfast every day for four weeks, how many dozen eggs will she eat?	7
Marissa walks a 12-mile forest trail, completing the first four miles in one hour and completing the next two miles in another hour. If she wants to keep her average speed at four miles per hour, how fast (in miles per hour) does she have to walk for the rest of the distance?	6
I have 10 liters of orange juice, which is two-thirds water, and I want to fill this with 15 liters of lemon juice, which is three-fifths water, but as I pour the orange juice, I make six liters of orange juice, and I'm going to dilute how many liters of water from the remaining 24 liters of fruit juice.	15
Raymond and Samantha are cousins, Raymond was born six years before Samantha, Raymond had a son when he was 23, if Samantha is now 31, how many years ago was Raymond's son born?	14
Billy sold a DVD on Tuesday, he had eight customers, the first three customers bought one DVD, the next two customers bought two, the last three customers didn't buy a single DVD.	7
A single candle will melt two centimeters per hour. If the candle is lit from 1 p.m. to 5 p.m., how many centimeters will the candle shorten?	8
Kyle bought last year's bestseller for $19.50, which is 25% off the original price.	26
Mary ordered a $12 chicken dish, five packs, three packs, four apples, $1.50 each, and a number of pizzas. Mary paid the entire $50 bill. If the pizza was $8.50, how many pizzas did Mary order?	2
Michka bought three shorts, three long pants, and three pairs of shoes: one shorts for $16.50, one long pants for $22.50, and one pair of shoes for $42. How many dollars did Michka spend on all the clothes?	243
Cynthia eats one cup of ice cream every night, she buys 15 boxes of ice cream that she can eat, $4.00 a box, and after 60 days, how many dollars will she spend on all of the ice cream?	16
Henry stopped twice during his 60-mile bike trip, he stopped once after 20 miles and then stopped again 15 miles before the end of the trail.	25
Gloria is shopping for shoes and finds a pair of boots that fits her budget, but she has to choose between a pair of boots and two pairs of high heels that are combined and are cheaper than five-dollar boots. If one pair of high heels costs $33 and the other is twice as expensive, the boots will cost a few dollars.	104
If the ages of Darrell and Allen are 7:11 apart, if they're 162 years old now, calculate Allen's age in 10 years.	109
So Gunther is trying to count jelly beans in dozens, and he asks his friends to guess how many jelly beans are in a dozen. One friend says 80 jelly beans, another says more than half as many as the first person, 20 jelly beans, the third says more than the first person, 25 percent, on average, and the friends guess how many jelly beans are in the dozen.	80
John takes care of 10 dogs, one of which spends .5 hours a day walking and doing personal chores, and how many hours a week does John spend taking care of dogs?	35
Gretchen has $110 in gold, with more than 30 silver coins.	70
So Shobhan has less jewels than Aaron, two seeds. Aaron has more than half the jewels that Raymond has five. If Raymond has 40 seeds, Shobhan has how many seeds?	23
Mike played 40 minutes of ping-pong, and in the first 20 minutes, he scored four points, and in the next 20 minutes, he scored 25 percent more points, and how many points did he score?	9
Terry's two yogurts a day, which is now down to four yogurts, $5.00 over 30 days, and he's spending a dollar on yogurt.	75
John was going to sell all his toys and use the money to buy video games. He had 13 sets of Lego and sold them for $15 each. He ended up buying eight video games for $20 each and $5 left. How many sets of Lego did he have left?	2
John runs 60 miles a week, three days a week, on the first day he runs for three hours, and the other two days he runs for half a day each, on the first day he runs at what, miles an hour?	10
Dana can run at four times the speed of walking, but she can jump at half the speed of running. If she can jump at three miles an hour, how many miles can she travel in six hours if she spends one-third of her time running and two-thirds of her time walking?	18
Brandon's iPhone is four times older than Ben's iPhone, Ben's iPhone is twice as old as Susie's iPhone, and if Susie's iPhone is a year old, how old is Brandon's iPhone?	8
Perg, the great dragon, sits atop Farbo Hill, and it blows fire at everything from 1,000 feet. Polly can throw a golden axe. The only known weapon to defeat a dragon is a 400-foot fire, which is within the range of the dragon's flame. But when Polly holds a kite, she can throw the kite three times as far as she can.	200
Grandma Jones baked five slices of apple pie for the fireman's lunch, she cut each slice into eight pieces and placed these five slices on the buffet table for guests to eat themselves, and when the service was over, after the guests had eaten their own slices, there were 14 slices left.	26
From the dietary data, it's 250 calories per unit consumption for one bag of french fries. If it's 300 grams of french fries, there are five units of consumption, how many grams of french fries can you eat if you have a calorie target of 2,000 calories per day and you've already gotten 1,800 calories.	48
Charlie wants to sell a candle made of beeswax, and a pound of beeswax can make 10 copies, and a pound of beeswax with candles costs $10. If he sells a candle for $2.00, he'll make a dollar profit if he sells 20 copies.	20
Meredith is a freelance blogger who writes about health and delivers to clients every day as a regular job. One blog post takes an average of four hours to research and write. Last week, she wrote five posts on Monday, and two-fifths as many on Tuesday.	104
Candice grabs 80 sheets of postcards, puts them in a briefcase, and goes to work at a coffee shop. On the way, she stops at a store and buys a pack of postcards. On the way, she puts one sheet of postcards on a 220-ounce cup of coffee. If she has 23 sheets left, how many sheets of postcards did she buy?	163
John buys twice as many red ties as blue ties, red ties are 50% more expensive than blue ties, he pays $200 for blue ties, which cost $40 each.	800
Tracy uses a four-foot-long line to cut the tomato trees in the garden into six-inch-long lines.	8
Richard lives in a 15-story apartment building, each floor has eight units, and three-quarters of the units are occupied.	30
Lloyd owns an egg farm, and his eggs lay 252 pounds a day, which he sells for $2 a dozen.	294
Tom's boat sails at 10 miles an hour, he sails from 1 to 4 and then he sails back at 6 miles an hour.	5
Uriah's bag was getting too heavy for him, he needed to take off 15 pounds, his comic books were a quarter of a pound, and his toys were a half a pound.	15
The repairman charges different rates for truck and car tires, for a truck tire, he charges $60 per line, and for a car tire, he charges $40 per line on Thursdays, six truck tires and four truck tires on Fridays, 12 truck tires and no truck tires on higher-earning days, how many dollars more per day?	40
While the Datefires were driving home with seven kittens they had adopted from a local shelter, their mother called to say that two of the cats had just given birth, and she said that the first one, Patchy, had three times as many kittens as the other, Trixie, had 12 kittens.	40
China has 30 smiles, China eats two smiles, China wants to put the rest of the smiles in bags, two bags each, how many bags of smiles will China share?	14
Peter is going to the movies this week, he usually buys tickets for $7 and popcorn for $7. If he had $42 this week, how many times could he go to the movies?	3
A wooden bridge can only hold a maximum of 5000 pounds. A transport truck carrying the same box, each weighing 15 pounds, will drive across the bridge. If the total weight of the driver and the empty truck is 3755 pounds, the maximum number of boxes that the car can carry without exceeding the weight limit of the bridge is equal to how many boxes?	83
Stephen ordered the invoice online, the total amount was $40.00 because he ordered through the shipping service, so the service charged him 25% of his total amount and charged him a $3.00 delivery fee. Stephen also added a $4.00 tip after adding all the additional fees.	57
A single raspberry tree has six berries, 20 of them, and there are 67 individual berries scattered throughout the tree, so how many raspberries are there?	187
A leaf of tomato has 25 oranges, which contains 1 rotten orange, 20% uncooked orange, 2 pickled orange and the rest are sweet oranges. How many sweet oranges are there?	17
Janet bought her daughter a necklace, she paid $500 for the material, and she paid $800 for the jeweler, and then she paid 10% of the premium on the necklace, so she paid what, $500?	1430
If Marcie works for the same company for 40 years, she gets a $50,000 annual pension, and from the 20th year on, she's entitled to a 5% annual pension on top of that.	25000
Alina subscribes to a streaming service that charges $140 per month, so if the streaming company charges the same as above for the first quarter, then the charge is reduced by 10% for the second quarter, so you can calculate the total amount she paid for the streaming service at the end of the year.	1596
So Sophia was going to take her car on a road trip, and she wanted to know how many miles a tank of gas would go after the last full tank of gas, and she had driven 100 miles, and she needed to fill up four gallons of gas to fill up again, and her driver's manual said that her tank had 12 gallons of gas, so how many miles would Sophia drive per tank of gas?	300
Jim spent two hours watching TV, then decided to lie in bed reading for half of that time, and he did this three times a week for four weeks.	36
Four schools competed in the basketball tournament, each school sent one women's basketball team and one men's basketball team, each team consisting of five players, each school also sent a coach to the other team.	48
A treasure hunter found a treasure chest full of hidden gems, in a chest of 175 diamonds, 35 less diamonds and twice as much marble.	595
Dr. Weitz's school has twice as many boys as girls. If the school has 60 girls and one teacher for every five students, how many teachers does the school have?	36
Bailey had a certain amount of money, and then she got a weekly allowance of $5 a week for eight weeks, so if she had $100 at the end of eight weeks, how many dollars did Bailey have at the beginning?	60
Judy teaches five dance classes on weekdays and eight classes on Saturdays. If each class has 15 students, and she pays $15.00 per person for a week, how many dollars does Judy make?	7425
Keeley has two recipes for cooking, one with 20 steps, and the second with twice as many steps.	60
Tommy is raising money for charity by selling $3 brownies and $4 cheesecakes. If Tommy sells 43 brownies and 23 cheesecakes, how many dollars does Tommy raise?	221
Sheila bought a $150 cell phone, divided into three months, each phone charged 2% interest, so in three months, how many dollars would Sheila have to pay per month?	255
Artie had a flower board at the farmers' market, and he sold three flowers: rose, peony, and begonia. Normally, he sold rose bushes for $2.74, rose bushes for $1.87, and begonias for $2.12, but today, Artie didn't have a ton of money, so he decided to subtract the price of all the flowers. If Artie sold 12 rose bushes, nine peony bushes, and 17 begonias, how many dollars would he get?	88
Luke finally built a sand castle on the beach, and he noticed that each sand castle had less space than the one below half a square foot. If he built a four-story sand castle with a 16-square-foot top floor, how many square feet would each floor average?	60
Cecilia just got a new puppy, and her vet said she's going to feed the puppy one cup of food a day for the first 180 days, then two cups of food a day for the rest of her life, so if one dog food bag is 110 cups of food, how many bags of dog food will Cecilia need to use in the first year?	5
If Raymond is one-half the size of Sarah, and Sarah is four times the size of David, then calculate the difference between Raymond's and David's laundry in the case of Sarah's 400 pounds.	100
Vincent could buy three bouquets for $2.50 or two bouquets for $1 if he bought 18 flowers at a lower price, how many dollars would he save?	6
John gets one of the doggy kits, he gets a $100 haircut, but the barber shop gives 30% off for new customers, so how much is a doggy haircut?	70
Two girls each pour one sixth of a pint, then the other boy pour six, and finally, how many liters of water are left?	10
Charlie had 10 stickers, he bought 21 stickers from the store in the mall, and he got 23 stickers for his birthday, and then Charlie gave nine stickers to his sister, and he used 28 stickers to decorate the greeting card.	17
Grace weighs 125 pounds, Alex weighs four times less than Grace's 2 pounds, how many pounds do they both weigh?	623
So, if you plant three rose bushes, each one will produce 25 flowers, each flower will have eight thorns, and how many thorns will there be in the rose?	600
The football team played 22 games, winning more than losing eight. How many games did the football team win in total?	15
Gene brings a souvenir shirt to the shop, and he buys a souvenir shirt every time he goes on vacation, and each shirt is in his own souvenir block, and each row of souvenirs is made up of a souvenir block from each year's vacation.	44
Greg set the alarm clock to use a memory three times a day, and when the alarm clock went off, the alarm clock would go off until Greg shut it down. The first alarm clock went off four times today, the second alarm clock went off three times longer than the first, the third alarm clock went off half the second, and then how many times did the clock go off?	22
The company pays employees $600 a month, and the company has a policy of increasing the salary of employees by 10% of the starting salary each year if the employee has been with the company for five years. If Sylvie has been with the company for five years as of last December, Sylvie will receive a total salary for the entire year after three more years of service.	9360
Marilyn's first single sold 10 times more than the Herald's. If Marilyn's song sold 88,000 copies, how much did the Herald sell?	8000
Christina is planning a birthday party and has to spend 0.75 gift bags per guest invited, since 1/4 of the invited guests did not attend, Christina has invited 16 friends, gift bags cost $2 each, how much will she have to pay?	24
Ted the Thyrex is planning to bring potato salad to a dinosaur picnic, and he knows that one adult dinosaur will eat 10 pounds of potato salad, and one baby dinosaur will eat half as much salad as one adult dinosaur, so if there are 20 adult dinosaurs and five baby dinosaurs, how many pounds of potato salad does he need to bring to the picnic if he wants to have enough for all the dinosaurs?	225
Jane has three times as many pets as Marcia, and Marcia has two more pets than Cindy, so if Cindy has four pets, how many pets will all three of them have in total?	28
Emily has four children, Amy Jackson, Corey, and James. Amy is five years older than Jackson and two years younger than Corey. If James is ten years old and one year younger than Corey, how old is Jackson?	4
Lee used to run the 400 meters two seconds faster than Gerald, but Gerald changed his diet to lose weight, making him 10% faster. If Lee ran the 400 meters in 38 seconds, Gerald, who went through a weight-loss diet, would be able to run the 400 meters in a few seconds.	36
In a neighborhood, there are more than a dozen pet rabbits than there are cats and dogs combined. If there are twice as many cats as there are dogs, and there are 60 dogs in that neighborhood, how many pets are there in total?	348
There are 200 fifth graders, two-fifths of whom are boys, and two-thirds of whom are girls, and how many girls are girls?	40
Last night, Harrenon slept nine hours, and his friend James slept only two-thirds of the time.	3
When Frida brings the tomatoes to make the sauce, the tomatoes are halved, each tomato she uses is 16 ounces, and each tomato has three tomatoes, and the last tomato sauce Frida made was 32 ounces, so how many tomatoes did Frida use?	12
On the freeway, there are cars following each other in a line, some of them moving through traffic jams in the first 15 minutes, then 20 cars moving through in the last 15 minutes of traffic jams, and five cars in a line using the exit so that they don't have to move through traffic jams.	5
Mary is a passionate gardener, and yesterday she received 18 new trees from her favorite nursery, along the windowsills of 40 of her country houses, where there are already two trees on each window, and out of a sense of sharing, she decided to give one tree on each window-sill to her friends and family, and tomorrow, Mary will have a few trees left.	58
Jerome had four friends come to visit on some days, the first friend knocked on the door 20 times before Jerome opened it, the second friend knocked on the door a quarter more than Jerome's first friend, the third friend knocked on the door 10 times more than the fourth friend, and if the fourth friend knocked on the door 60 times, how many times was the door knocked on?	175
Solo had to read four pages of science textbooks, 20 pages of social studies textbooks, seven pages of history textbooks, and eight pages of geography textbooks on Monday. Solo read 15 pages of books. If he had four days to read each page, how many pages would he have to read on an average day?	6
John would drink a glass of water with his breakfast, lunch, and dinner, and then he would drink another glass of water before he went to bed, which John would do every day, but on the weekends, he would relax and drink soda with dinner instead.	26
The fog lines from the ocean move in and cover the city, taking 10 minutes to cover the city every three miles. If the city is 42 miles from the ocean shore and sits on the opposite bank on a hill, the fog will cover the entire city in minutes.	140
Poppy is doing 1,000 jigsaws, she's doing a quarter of the total on the board, then her mother is doing a third of the remaining number, and then how many more jigsaws are left?	500
Cody ate three times as many cookies as Aamir. If Aamir ate five cookies, how many cookies did they both eat?	20
John has three boxes, each box is 5 inches by 6 inches by 4 inches, the sides of the boxes are 1 inch thick, what is the total volume inside the three boxes?	72
Every night, Frankie watches TV after he's done his homework, and on Mondays and Tuesdays, he watches his favorite hour-long show, one episode each night, on Wednesdays, he watches a 30-minute show, a few episodes, on Thursdays, he finishes his homework early, and then he watches an hour-long show, one episode, and then another 30-minute show, and on Fridays, he can sleep in late because he's off on the weekends, so he watches two hour-long shows, if he watches seven hours of TV in total, and on Saturdays, he watches a 30-minute show, how many episodes?	3
Henry was making cookies for the local bake-off, and he wanted to make twice as many cookies as he had made last year, and when he finished baking, he realized he had made 15 more cookies, and he made five cookies while he was taking them out to cool down, and now he had 110 cookies.	50
A local gas station owner is selling gas at $3.00 a gallon, and the app development company is offering a $0.20 a gallon refund if you fill up at this pump, and if you buy 10 gallons of gas, how much will that be after the refund?	28
Marcel and Beatrice were competing to see who could eat the most rolls of dried fruit, so they both scooped up as many rolls of dried fruit as they could find, but someone made a mistake. Beatrice's rolls were two by 24 while Marcel's were three by 14. If both of them ate all the rolls of dried fruit, how much would they eat on average?	45
Julia's boat broke while she was in the lake, and for every ten feet she went back to shore, two liters of water flowed into the boat. It took Julia sixteen seconds to sail twenty feet, and the shore was 64 seconds away.	16
A classroom has a whiteboard that is shared by four teachers who are in turn using the classroom, each teacher teaching two classes a day, and in each class using the whiteboard. If in each class the whiteboard is deleted three times in a day, how many times is the whiteboard deleted?	24
Ryan plants two flowers a day in his garden, and after 15 days, how many flowers will he have if five flowers don't grow?	25
Jamal's phone has six times the photographic capacity of a British phone, and the British phone has 50 times the photographic capacity of the ducks in Jamal's photos of the zoo. If Jamal's phone has 1,800 photos, how many ducks can be seen in Jamal's photos of the zoo?	6
Sasha noticed that the price of wood had gone up by 50% in the last few months after she bought some of the wood, because she had some leftover wood, so she decided to sell it, and she had 10 pieces of wood, 2 x 4 x 10, for $10 each, and she also had five pieces of wood, 4 x 4 x 10, for $16 each.	90
Kate brews coffee using sugar units as teaspoons and water units as glasses in the ratio 7:13. If the number of teaspoons of sugar and the number of glasses of water she uses add up to 120, then calculate how many teaspoons of sugar she uses.	42
John bought three children two pairs of shoes for $60 each.	360
