Janet's ducks lay 16 eggs a day. Every morning, she eats three for breakfast and uses the other four to make muffins for her friends. What's left over, she sells daily at the farmers market, at $2 a fresh duck egg. How much (in dollars) does she make each day at the farmers market?	18
A dress requires two rolls of blue fiber and half that amount of white fiber.	3
Josh goes into a home renovation business, buys a house for $80,000, invests $50,000 in the renovation, and the house goes up in value by 150 percent.	70000
Jacques runs three sprints three times a week. He runs 60 meters in each sprint. In total, how many meters does he run per week?	540
To keep her chickens healthy, Wendi gives them three bowls of mixed food containing seeds, mealworms and vegetables every day. She feeds them in three separate meals. In the morning, she gives them 15 bowls of food. In the afternoon, she gives them another 25. If her farm has 20 chickens, how many bowls of food should she give them for the last meal of the day?	20
Kylar goes to the store to buy glasses for his new apartment. A glass costs $5, but each second glass costs only 60 percent of the price. Kylar wants to buy 16 glasses. How much will he have to pay to buy them?	64
Toulouse has twice as many sheep as Charleston, Charleston has four times as many as Seattle, if Seattle has 20 sheep, how many sheep do Toulouse, Charleston and Seattle have in total?	260
Carla is downloading a 200GB file. She's downloading at 2GB per minute but at 40% download, Windows requires a restart to install the updates, which takes 20 minutes. Carla then has to start the download again from the beginning. How long does it take to download the file?	160
John drives for 3 hours at a speed of 60 mph, then turns back after realizing that he forgot something very important at home. He tries to get home in 4 hours, but loses the first 2 hours in traffic jams. For the next half hour, he drives at 30 mph, before driving at 80 mph for the remaining time on the 4 hours. What is the distance between him and his home at the end of the 4 hours?	45
For the first 40 hours of work a week, Elisa's hourly rate is $10 and for her overtime hours, she also receives 1.2 times her normal hourly rate. If Elisa worked 45 hours this week, what will her weekly wage be?	460
A new program was downloaded 60 times in the first month. The number of downloads in the second month was three times that of the first month. It then decreased by 30 percent in the third month. How many times in total was the program downloaded in those three months?	366
Toula bought several different pastries at the bakery. She bought three dozen doughnuts at $68 a dozen, two dozen cupcakes at $80 a dozen, and six dozen cheesecake cupcakes at $55 a dozen. What is the total cost?	694
Carlos wants to plant a lemon tree. The cost of planting is 90 dollars. Each year, the tree will produce seven lemons that will be sold for $1.5 each. Watering and feeding the tree costs $3 per year. How many years will it take Carlos to start making money with his lemon tree?	13
Melanie sells from door to door. When she moved to the green house, she sold a third of her vacuum cleaners, then two more to the red house, and finally half of what was left in the orange house. If Melanie has five vacuum cleaners left, how many vacuum cleaners did she have at the beginning?	18
In a dance class of 20 students, 20 percent of them are enrolled in contemporary dance, 25 percent in jazz dance, and the rest in hip-hop dance. What is the percentage of students enrolled in hip-hop dance?	60
A trader hesitates between two buying plans: jewelry worth $5,000 or electronics worth $8,000. His financial advisor speculates on a 2.5% increase in the jewelry market and a 1.2% increase in the electronics market during the same month. If the trader makes a choice that maximizes his profit at the end of the month, what would that profit be?	125
Two trains leave San Rafael at the same time. They first head west and both travel 80 miles. The next day they travel north, covering 150 miles. What is the distance each train traveled in those two days?	230
Jill makes $20 an hour as a teacher and $30 an hour as a cheerleading coach, so if she works 35 hours a week as a teacher, 15 hours a week as a coach, and 50 weeks a year, what is her annual salary?	57500
For her breakfast, Claire makes an omelet of three eggs every morning. How many dozen eggs will she eat in four weeks?	7
Marissa is hiking a 12-mile trail. She took an hour to walk the first four miles, then another hour to walk the next two miles. If she wants her average speed to be 4 miles per hour, what speed (in miles per hour) does she need to reach to walk the remaining distance?	6
I have 10 liters of orange juice made up of two thirds water. I want to mix it with 15 liters of pineapple juice made up of three quarters water, I turn over a liter of orange juice. How much water is in the remaining 24 liters?	15
Raymond and Samantha are cousins. Raymond was born six years before Samantha and had a son at the age of 23. If Samantha is now 31, how old is Raymond's son?	14
Billy sells DVDs. This Tuesday, he has 8 customers. His first 3 customers each buy one DVD. The next 2 customers each buy two. The last 3 customers don't buy any. How many DVDs did Billy sell on Tuesday?	7
A candle that's lit is melting and losing two centimeters every hour. How many centimeters will the candle have lost after burning from 1 to 5 p.m.?	8
Kyle bought last year's bestseller for $19.50, with a 25% discount on the original price.	26
Mary ordered a chicken dish that costs $12, five cartons of milk for $3 each, four apples for $1.50 each, and a few boxes of pizza. Mary paid a total of $50 for each box of pizza. If each box of pizza costs $8.50, how many boxes did Mary order?	2
Mishka bought 3 shorts, 3 pants and 3 pairs of shoes. A short costs $16.50, a pants $22.50 and a pair of shoes $42. How much money did Mishka spend in total on the purchase of these clothes?	243
Cynthia eats one serving of ice cream every night. She buys boxes of 15 servings of ice cream each, at $4.00 a box. After 60 days, how much will she spend on ice cream?	16
Henry made two stops during his 60-mile bike trip. He marked his first stop after 20 miles. He stopped again 15 miles before the end of the trip. How many miles did he travel between the two stops?	25
While shopping for shoes, Gloria comes across a pair of boots that fit her budget. However, she must choose between the boots and two pairs of high heels that cost two and a half dollars less than the boots. If one of the high heels costs $33 and the other costs twice as much, what is the dollar price of the boots?	104
If the sum of their ages is 162 years, how old will Allen be in 10 years?	109
Gunter is trying to count the candy in a jar. He asks his friends to estimate the amount. One of them says 80, another says 20 more than half of the first one. A third says 25 percent more than the first one. What is the average of their estimates?	80
Jean takes care of 10 dogs. Each dog needs half an hour a day to walk and do other things. How many hours does Jean spend a week taking care of dogs?	35
Gretchen has 110 coins. The gold coins are 30 coins more than the silver ones. How many gold coins does Gretchen have?	70
If Raymond has 40 pieces of jewelry, how many pieces of jewelry does Siobhan have?	23
Mike plays ping-pong for 40 minutes. In the first 20 minutes, he scores four points. He scores 25 percent more points in the next 20 minutes. How many points did he score in total?	9
Terry eats two yogurts a day, and they sell them for the price of four yogurts for five dollars.	75
John wants to sell all his toys and use the money to buy video games. He owns 13 Lego sets and sells them for $15 each. Eventually, he buys himself eight video games at $20 each, which leaves him with $5. How many Lego sets does he have left?	2
John runs 60 miles every week. He runs three days a week. On the first day he runs for three hours and runs twice as much the other two days. What is his running speed?	10
Dana runs four times faster than she walks, but jumps twice as fast as she runs. If she jumps at three miles per hour, how many miles does she cover in six hours, knowing that she spends one-third of that time running and two-thirds walking?	18
Brandon's iPhone is four times older than Ben's. Ben's iPhone is twice as old as Suzie's. If Suzie's iPhone is one year old, how old is Brandon's?	8
Perg, the great dragon, sat atop Mount Farbo and spewed fire from a distance of 1,000 feet. Polly could throw the golden spear, the only weapon capable of piercing the dragon, but to a distance of 400 feet, well within range of its flames. However, when Polly held the sapphire stone, she could throw it three times farther. By holding the gemstone, how far could Polly keep herself out of the reach of the flames, while still managing to strike the dragon with the golden spear?	200
Grandma Jones prepared five apple pies for the firefighters' lunch. She then cut each pie into eight pieces and arranged the five pies on the buffet table for everyone to serve themselves. At the end of the evening, after all the guests had taken and eaten their pies, there were 14 pieces left. How many pieces did the guests take?	26
According to its nutritional information, a bag of chips contains 250 calories per serving. If a 300-gram bag contains five servings, how many grams of chips would you eat, knowing that your daily calorie target is 2,000 and that you've already consumed 1,800 calories?	48
Charlie wants to sell beeswax candles. Each pound of beeswax allows him to produce 10 pointed candles. A pound of beeswax and fuses is delivered for $10. If he produces and sells 20 candles, what is his net profit, knowing that each candle is sold for $2.00?	20
Meredith is a freelance blogger whose job is to write articles on health topics and submit them to clients every day. A blog post takes an average of 4 hours of work, which includes research and writing. Last week, she wrote 5 articles on Monday and 2/5 times as many articles on Tuesday. On Wednesday, she wrote twice as many articles as she wrote on Tuesday. Calculate the total number of hours spent writing articles during those three days.	104
Before going to work at the coffee shop, Candice put 80 pens in her purse. On the way, she stopped to buy a pack of pens at the store. When she got to work, she put one pens on each of the 220 coffee cups. If she ended up with only 23 pens left, how many pens were in the pack she bought?	163
John buys twice as many red ties as blue ties. Red ties cost 50% more. He spent $200 on blue ties that cost $40 each. How much did he spend on ties?	800
To support the tomato plants in her garden, Tracy used a 4-foot-long iron wire. This wire was cut into several 6-inch-long pieces. How many pieces did she get?	8
Richard lives in one of the apartments in a 15-story building. Each floor contains 8 apartments. Given that three-quarters of the building is occupied, what is the total number of unoccupied apartments in the building?	30
Lloyd owns a chicken coop. His hens produce 252 eggs a day and they sell them for $2 a dozen. How much does Lloyd make a week from his eggs?	294
Tom's boat is moving at 10 miles per hour. He sails from 1 to 4 p.m., then makes the return trip at the speed of 6 miles per hour. How long will it take him to get back?	5
Uriah's bag becomes too heavy for him. He has to reduce it by 15 pounds. Each of his comic strips weighs a quarter of a pound and each of his toys weighs a half pound. If he removes 30 comic strips, how many toys will he have to remove?	15
A mechanic makes different rates for truck and car tires. For each truck tire repaired, he charges $60, and he charges $40 for each car tire. On Thursday, he repairs six truck tires and four car tires. On Friday, he repairs 12 car tires and doesn't repair any truck tires. On the day when the earnings were highest, how much money did the mechanic make in addition?	40
The Doubtfire sisters leave the local animal shelter with seven adopted kittens in their car. On the way back, they receive a call from their mother informing them that their two domestic cats have just had kittens. She says that Patchy, the first cat, has had three times the number of adopted kittens, while Trixie, the other, has had 12. How many kittens does the Doubtfire family have now?	40
John has 30 lollipops. He eats two. With the remaining lollipops he wants to make bags of two lollipops each. How many bags will John get?	14
Peter plans to go to the movies this week. He always buys a $7 ticket and $7 popcorn. If he has $42 for the week, how many times can he go to the movies?	3
A delivery truck is about to cross a wooden bridge that can't carry a load of more than 5,000 pounds. The truck is filled with identical boxes, weighing 15 pounds each. The combined weight of the driver and the empty truck is 3,755 pounds. How many boxes can be loaded onto the truck without exceeding the weight limit of the bridge?	83
Stephen ordered groceries online. His final bill was $40.00 and because it was a delivery service provider, they raised the bill by 25 percent and added $3.00 in delivery fees. Stephen also gave a $4.00 tip. Counting the additional fees, what was the final price of Stephen's order?	57
A raspberry tree has six bunches of 20 fruits each, as well as 67 individual fruits scattered throughout the tree.	187
A basket contains 25 oranges, of which one is bad, 20 percent are not ripe, two are sour and the rest are good. How many oranges are good?	17
Janet buys a pin for her daughter. She spends $500 to get the manufacturing equipment, then an additional $800 to get it made by a jeweler. Then she spends 10% of that money to get it insured. How much did she spend in total?	1430
If Marcy works for the same company for 40 years, she receives a pension of $50,000 a year. After 20 years of work, she is entitled to 5% of that amount per year. Assuming she resigns after 30 years of service, what will her annual pension be?	25000
Aleena subscribed to a streaming service that charges her $140 a month. If the streaming company charged that amount in the first half of the year, then 10% less in the second half of the year, calculate the total amount she paid for the streaming service at the end of the year.	1596
Sophie is considering a car trip and wonders how far she can travel with one full tank of gas. She has done 100 miles since the last fill and had to add 4 gallons of gas to fill the tank again. The user manual says her tank has a capacity of 12 gallons of gas. How many miles can Sophie travel with one full tank of gas?	300
Jim spends two hours watching TV, then decides to go to bed and read for half the time he spends watching TV. He repeats this three times a week. How many hours does he spend watching TV and reading in four weeks?	36
A basketball tournament hosts four schools competing. Each school sent a women's team and a men's team, each with five players. The schools also sent each a coach. How many people did the schools send in total?	48
A treasure hunter dug up a chest full of precious stones. This chest contained 175 diamonds, 35 rubies less than the amount of diamonds, and twice as many emeralds than rubies. How many precious stones were in the chest?	595
There are twice as many boys as girls at Dr. Wertz's school. If there are 60 girls and 5 students per teacher, how many teachers are there?	36
Bailey has a certain amount of money to start with, and then she gets a $5 weekly allowance for eight weeks, and if she ends up with a total of $100 at the end of eight weeks, how much money did Bailey start with?	60
During the week, Judy gives five dance classes every day and eight classes on Saturdays. If each class has 15 students and she charges $15.00 per student, how much money does she make in a week?	7425
Kélian prepares dishes based on two recipes, one with 20 instructions and the other with twice as many instructions as the first. How many instructions does Kélian have to read to prepare both dishes?	60
Tommy raises money for his charity by selling brownies at $3 a slice and cheesecake at $4 a slice. If Tommy sells 43 brownies and 23 slices of cheesecake, how much money did Tommy raise?	221
Shiela bought five cell phones at a price of $150 each, payable in 3 installments. An interest of 2% will be charged for each unit. How much will Shiela have to pay each month for 3 months?	255
Artie sells flowers at the farmers' market. He sells three types: soucis, petunias, and begonias. He usually sells soucis for $2.74 a pot, petunias for $1.87 a pot, and begonias for $2.12 a pot. Since he has no currency today, Artie decides to round all his prices to the nearest dollar. If he sells 12 pots of soucis, 9 pots of petunias, and 17 pots of begonias, how much money will he make?	88
Luke spends time building sand castles on the beach. He notices that each floor of a sand castle has half the floor area of the lower floor. What is the average floor area, knowing that the sand castle has 4 and the highest floor has an area of 16 square feet?	60
Cecilia just bought a new puppy. According to the vet, she'll have to give him one bowl of dog food every day for the first 180 days. Then she'll have to give him two bowls every day for the rest of his life. If one bag of food is 110 bowls, how many bags of dog food will Cecilia use in the first year?	5
So, given that Sarah does 400 pounds of laundry, calculate the difference between the amount of laundry Raymond and David do.	100
So, if Vincent has a choice between buying flowers in a three-pack for $2.50 or a two-pack for $1. How much money will he save if he buys 18 flowers at the best price?	6
John adopts a dog and takes it to the groomer for $100, and the groomer offers him a 30% discount, since he's a new customer.	70
Two girls each received 1/6 of the 24 liters of water. A boy then received 6 liters of water. How many liters of water are left?	10
Charlie had 10 stickers. He bought 21 more in a department store at the mall and got 23 for his birthday. Then he gave 9 to his sister and used 28 to decorate a greeting card. How many stickers does he have left?	17
Grace weighs 125 pounds. Alex weighs two less than four times Grace's weight. What is the sum of their two weights in pounds?	623
Dan plants three rose bushes. Each rose bush has 25 roses and each rose has eight thorns. How many thorns are there in all?	600
A football team has played 22 games, they've won more times than they've lost.	15
Gene makes a t-shirt out of old t-shirts. He has a t-shirt for every vacation trip he's ever taken. Each t-shirt is one of the squares in the t-shirt. Each row of squares corresponds to a different vacation year. Since he's 23, he's been going on vacation four times a year. He's 34 now. How many squares does his t-shirt total?	44
Greg has an alarm set to go off three times a day. When the alarm goes off, it goes off until Greg turns it off. The first time it went off today, it went off four times. The second time, it went off three times longer than the first time. The third time, it went off twice as long as the second time. How many times did the alarm go off in total?	22
A company pays $600 per month to each employee. It has a policy to add 10 percent to the starting salary of each of its employees with five years of service. If Sylvie just completed five years with the company last December, what will her annual salary be after three additional years of service?	9360
Marilyn's first record sold 10 times as many copies as Harald's, so if they sold 88,000 copies together, how many copies did Harald sell?	8000
Christina throws a birthday party and asks for 0.75 gift bags per guest, since 1/4 of the guests don't show up, knowing that she invited 16 friends and that the gift bags cost $2 each, how much will she spend?	24
Ted the tyrannosaur plans to bring potato salad to the dinosaur picnic. He knows it will cost 10 pounds for an adult dinosaur and half that for a child. If there are 20 adults and 5 children at the picnic, how many pounds of potato salad does Ted have to bring to feed everyone?	225
Jan has three times as many pets as Marcia. Marcia has two more than Cindy. If Cindy has four pets, how many pets in total do they all have?	28
Emily has four children named Amy, Jackson, Corey, and Jacques. Amy is five years older than Jackson and two years younger than Corey. If Jacques is ten years and one year younger than Corey, how old is Jackson?	4
Lee used to run the 400 meter hurdles two seconds faster than Gerald. But after changing his diet, Gerald improved his speed by 10 percent. If Lee runs the 400 meter hurdles in 38 seconds, what is Gerald's running time in seconds after his new diet?	36
In a certain neighborhood, the pet rabbit population is twelve units less than the total number of pet dogs and cats. If for every dog there are two cats and there are 60 dogs in total, how many pets are there in the neighborhood?	348
Of the 200 students in the sixth grade, two-fifths are boys and two-thirds of the girls are members of the Boy Scouts.	40
Harry slept nine hours last night. His friend Jacques slept only two-thirds of that time. Compared to Jacques, how many more hours did Harry sleep?	3
When Freda cooks canned tomatoes to make sauce, they lose half their volume. She uses 16-ounce cans that each contain three tomatoes. Freda's last tomato sauce preparation yielded 32 ounces of sauce. How many tomatoes did Freda use?	12
Cars are stuck in a queue on the highway. Some cars manage to get through in the first 15 minutes of the traffic jam, then 20 other cars in the last 15. 5 cars get out of the queue so they don't have to cross the traffic jam. Given that there were initially 30 cars on the highway, how many cars crossed the traffic jam in the first 15 minutes?	5
Mary loves gardening. Yesterday she received 18 new potted plants from her favorite nursery. She already had two on each of the 40 windowsills of her large country house. So she decided that tomorrow she would take one potted plant from each window sill and give it generously to friends and relatives. How many potted plants would Mary have left?	58
One day, four friends visited Jerome. The first one rang the bell 20 times before Jerome opened, the second one 1/4 times longer than the first, and the third 10 times longer than the fourth. Given that the fourth friend rang the bell 60 times, how many times did the bell ring in total?	175
Solo has to read four pages of his science textbook, 20 pages of the social studies textbook, seven pages of the history textbook, and eight pages of the geography textbook. This Monday, he read 15 pages. If he has only four days left to finish reading, how many pages will it take him to read on average every day?	6
John likes to drink a glass of water at breakfast, lunch, and dinner. Finally, he also drinks one before going to bed. He follows this routine every day of the week. On weekends, however, he likes to relax and drink a soda at dinner. How many glasses of water does John drink in a week?	26
A bank of fog comes from the ocean and gradually covers a city. It takes 10 minutes to cover 3 miles of the city. If the city extends 42 miles from the edge of the ocean to the opposite edge inland, how many minutes will it take for the bank of fog to cover the entire city?	140
Poppy is trying to solve a puzzle of 1,000 pieces. She puts a quarter of the pieces on the board, then her mother puts a third of the remaining pieces. How many pieces of the puzzle are left to place?	500
Cody eats three times as many cookies as Amir. If Amir eats five cookies, how many cookies do they both eat in total?	20
John has three boxes, each box is five by six by four inches, the walls are one inch thick, what is the total volume of the three boxes?	72
Every night, Frankie watches TV after doing his homework. Last Monday and Tuesday, he watched an hour of his favorite show every night. Wednesday, he watched a few episodes of a 30-minute show. Thursday, he finished his homework early and watched an hour and a 30-minute show. Friday, he was able to stay up late because of the weekend, and so watched two hour-long episodes each. If he watched a total of seven hours of television, how many 30-minute episodes did he watch on Wednesday?	3
Henri is making cookies for a local baking contest. He wants to make twice as many as last year. At the end of the batch, he finds that he has made 15 more cookies than he planned. He drops five of his cookies while he cools them and ends up with a total of 110 cookies. How many cookies did Henri make last year?	50
A gas station sells gas at $3.00 a gallon, an app company offers a $0.20 refund per gallon if you fill up at that station, if someone buys 10 gallons of gas, what will be the purchase price, after the refunds?	28
Marcell and Beatrice compete to see which of the two eats the most fruit rolls, so they roll as many as they can find. Unfortunately, due to a mistake, Beatrice ends up with two wide rolls and 24 long rolls, while Marcell gets three wide rolls and 14 long rolls. If each of the two eats all of his rolls, how many have they eaten on average?	45
A leak occurred in Julia's boat while she was on the lake. The boat started taking two liters of water every ten feet rowed towards the shore. It took her sixteen seconds to go twenty feet. The shore being 64 seconds, how much water had the boat taken when Julia reached the shore?	16
A classroom has a whiteboard shared by four teachers who take turns using the room, and each of them teaches two classes a day and uses the whiteboard every time. If the whiteboard is cleaned three times per lesson, how many times is it cleaned in a day?	24
Every day, Ryan plants two flowers in his garden, and if five of them haven't bloomed, how many flowers will he have in two weeks?	25
