Jamal's phone can store six times as many photos as Brittany's phone, and Brittany's phone can store up to 50 times as many birds as there are birds in the photo that Jamal took, where we see ducks in the zoo. If Jamal's phone has a capacity of 1,800 photos, how many ducks can we see in the photo that he took?	6
Sasha, after buying some timber, notices that the price has gone up by 50 percent in the last few months, so she decides to sell the remaining timber. She has ten 2x4x10 boards left, which cost her $10 each. She also has five 4x4x10 boards, which she bought for $16 each. If she can sell them all, what will be her profit?	90
Katy makes coffee using teaspoons of sugar and cups of water in a ratio of 7:13. Calculate the number of teaspoons she poured, knowing that she used a total of 120 teaspoons of sugar and cups of water.	42
For each of his three children, John buys two pairs of shoes that cost $60 each. How much did he pay?	360
A customs officer at the main customs clearance port of SeaSide counted 2 containers of imported vehicles, each with 5 vehicles inside. The next day, new containers arrived and brought the total number of vehicles present in the port to 30. Calculate the number of containers imported on the second day, assuming that all containers contain 5 vehicles.	4
Adrian's total salary was 30% higher than Lylah's. Four years later, that salary had increased and was 40% higher than what he was earning at the start. If Adrian and Lylah's salaries increased simultaneously, and Adrian was earning $40,000 four years ago, calculate the total amount of their two salaries four years later.	95200
Miguel uses two boxes of paper a week for his drawing. If each box contains 30 sheets of paper, how many sheets of paper does he use per month?	240
Morisette and Kael were asked to bring fruit. Morisette brought 5 apples and 8 oranges, while Kael brought twice as many apples and half as many oranges as Morisette. How many fruits did they bring in total?	27
Sadie slept 8 hours on Monday. She slept 2 hours less each of the two days that followed, because of certain obligations. Knowing that the rest of the week she slept 1 hour more than on those two days, how many hours did she sleep in total during the whole week?	48
Rosie runs at 10 miles per hour for three hours, then she runs 5 miles per hour, how many miles will she have traveled in seven hours?	50
Jennie brings a helper to her mother's office. She has a stack of 60 letters to stamp and another with letters already stamped. She stamps a third of the letters to stamp. If there are now 30 letters in the stack of stamped letters, how many were there in that stack when Jennie started the work?	10
Julia was preparing for a dinner party at her house, during which she was going to serve stew. She noticed that she had no more plastic spoons, so she bought a new pack of spoons. Later, her husband also bought a pack of five new spoons and gave them to Julia. During cooking, Julia used three spoons to taste her stew. Later, when she went to set the table, she had a total of 12 spoons. How many spoons were in the pack Julia bought?	10
Dylan needed chicken sausage and fish sausage to make sausage rolls at a party. He bought 38 chicken sausage and 6 fish sausage more than there were chicken. How many sausages did Dylan buy in total?	82
After being transferred to a new school, Amy made 20 more friends than Lily. If Lily made 50 friends, how many friends do Lily and Amy have in total?	120
Well's mother sells watermelons, peppers and oranges at the local store. A watermelon costs three times as much as a pepper and an orange is five times cheaper than a watermelon. Dillon is sent to the store to buy four watermelons, 20 peppers and 10 oranges. What is the total amount he will spend if each pepper costs $15?	880
A hospital admits 500 people a day. Each patient is examined for an average of 24 minutes. Doctors charge the hospital $150 per hour and the hospital charges the patients $200 per hour. How much profit does the hospital make from these consultations?	10000
Nissa hires 60 seasonal elves to play Santa's village in her department store. One-third of the elves quit after kids threw up on them, then 10 of the remaining elves quit after kids kicked them in the shin. How many elves are left?	30
In May, Joseph's expenses were $500, down from $60 in June.	940
Pam and Fred went to a carnival. Pam rode the roller coaster twice and Fred rode it four times. Then each of them rode the sled twice. If each ride costs six tickets, how many tickets did they use that day?	60
On Monday, Walt walked four miles. On Tuesday, he walked six times as many miles as on Monday. His Monday-Wednesday mileage was 41 miles. How many miles did he walk on Wednesday?	13
Tom does four car washes a month. If each car wash costs $15, how much does he spend in a year?	720
Brian's friend Bobby has five video games less than three times the amount of video games Brian has. If Brian has 20 video games but lost five just before the comparison started, how many video games does Bobby have?	40
There are only 27 unicorns left in the world. One third of them are in the Highlands of Scotland. Two thirds of the Scottish unicorns are female. How many Scottish unicorns are there?	6
Rory orders two submarines for $7.50 each, two packages of fries for $1.50 each, and two cookies for $1.00 each, and a 20% delivery fee is charged at the checkout counter, and Rory adds a $5.00 tip.	29
Yesterday, Marc took a 75-question test. He took it at a rate of five questions per hour. Today, he took another 100-question test at the same rate. If Marc took eight hours to do the first test and six hours for the second, how many questions remained unanswered?	105
In a candy machine, there are 22 times as many blue gummy bears as there are four times as many pink gummy bears. If there are 12 blue gummy bears, how many roses are there?	70
Of the 20 rental cars available, 12 are automatic cars, 4 are manual cars and the rest are semi-automatic.	20
A hive has 700 bees. There are twice as many worker bees as baby bees and twice as many baby bees as queen bees. How many worker bees are there?	400
Jordan spends two hours a day playing video games. He also has a part-time job that pays him $10 an hour. How much money would Jordan make in a week if his playing time was spent working?	140
John buys $2 milk, $3 eggs, $3 light bulbs, $3 cups, and $4 cockroach traps, and considering that a 10% tax applies to all non-food items, how much did all of this cost?	16
Kim has started his own cleaning company and calculates the profit he can make from his clientele. He already has 3 clients, but his discussion with 5 other potential clients makes him confident enough to include them in his calculations. 2 bottles of bleach and a pack of rags will be needed to maintain each client's home. It will cost $2 per bottle of bleach and $5 per pack of rags. These are his only expenses. He calculates that his total income each week will be $92. Given the difference between total income and total expenses, in dollars, what profit will Kim make each week?	20
John has a 10 hectare pineapple field. Knowing that there are 100 pineapples per hectare and that John harvests them every three months, how much can he harvest in a year?	4000
Johnny collects the toys lying around in his room. He dropped a 500-piece Lego set, another with three times as many pieces, and a final one with a quarter of the number of pieces. How many pieces does Johnny collect in total?	2,125
Debra monitors a hive to see how many bees are coming in and going out in a day. She sees 30 bees leaving the hive in the first six hours, then sees half of them coming back in the next six hours. Then, in the next six hours, she sees twice as many bees flying away as those that left the hive the first time. Then, in the next six hours, all the bees that had left and had not yet returned return to the hive. How many bees did Debra see come back to the hive in the last six hours of the day?	75
Brittany and her mother go to the museum. The entrance fee is $12 for adults and $10 for children. Brittany's mother gives the cashier money for one child ticket and one adult ticket. If she received a difference of $8, how much money, in dollars, did she give to the cashier?	30
Charlie has three times as many Facebook friends as Dorothy. Jacques has four times as many as Dorothy. If Charlie has 12 Facebook friends, how many does Jacques have?	16
Steve and Tim decide to see which of them will get home from school faster. Steve lives further away than Tim and therefore has the right to use his bike. Steve lives 3 miles from school and pedals at 440 feet per minute. Tim lives 2 miles from school. If Tim is traveling on a skateboard at a speed of 264 feet per minute, how long will the winner wait at home before the loser finishes the race?	4
Shawnda thinks that a bike inflation service would be very useful for the kids in her neighborhood. She chooses to charge by the tire. Inflation of each tire costs 25 cents. On the first day, 5 people came to inflate the two tires of each of their bikes. 3 people came to inflate all the tires of their tricycles. Finally, one person came by unicycle. How much money did she make that day?	5
Carl buys ten packets of cookies, each package contains six cookies, each cookie costs $0.10. How much change does Carl get if he pays with a $10 bill?	4
Dave bought a big packet of fries and ate fourteen of them before a hungry gull stole the packet from his hands. When the gull landed, it swallowed half the amount of fries Dave had eaten. Then three pigeons forced the gull away from the food and each of them was able to eat three fries. Later, a raccoon stole two-thirds of the remaining fries. The ants took away one last, leaving five fries. How many fries were in the packet when Dave bought it?	48
On Mondays, Wednesdays and Fridays, the student Kimo has three one-hour classes per day. On Tuesdays and Thursdays, he has two two-hour classes each day. If there are 16 weeks of school per semester, how many hours does Kimo devote to his classes during a semester?	272
Every day, Bill makes 300 buns, 120 chocolate croissants, and 60 sticks. The buns are 4 inches each, the croissants are 6 inches each, and the sticks are two feet each. If Bill puts all the baked goods end to end, what will their length be in feet?	280
To feed the monkeys in the zoo, the keeper orders bananas from a local farm every two months. If it takes 200 bananas for the macaques, 400 for the gorillas and 100 for the baboons, how many must he order to last for two months?	1400
Blake and Kelly compete to see who can run the most in 15 minutes. They decide to do it on a 100-yard football field. Blake runs 15 laps. Kelly runs one lap, then decides she doesn't want to run alongside Blake. So she starts running the lap by limiting herself to the 40-yard line. She does it 34 times. How many yards did the winner run more than the loser?	80
Raphael went to the school supply store and bought four pens for $1.50 each, two notebooks for $4 each and a paperweight for $20.	34
Finn observes 11 tadpoles swimming in the pond. He suddenly sees 6 of them emerge from under a lily tree, then 2 hide under a rock. How many tadpoles can Finn now see in the pond?	15
A water tank is 17 feet deep on Monday. On Tuesday, the tank contains 7 feet more water. On Wednesday, the water tank is two-thirds as deep as it was on Tuesday. How deep is the water tank on Wednesday?	16
Anakin and Locsin went to the beach today. Anakin caught 10 starfish, 6 hippocampa and 3 clownfish. Locsin caught 5 starfish less than Anakin, 3 hippocampa less than Anakin and 2 clownfish more than Anakin. How many fish did they both catch?	32
If a bag of marbles costs $20 and the starting price goes up 20% every two months, how much will a bag of marbles cost after 36 months?	92
If you have several toys in a room: five red cars, three figurines and a doll, and the doll costs the same as the three figurines, and a red car costs $4, given that the figurine costs $5, what is the total value of the toys?	50
Jackie wonders if she should do her tax returns herself or hire an accountant. By doing it herself, she can do three hours of freelance work less, which is a $35 per hour shortfall. The accountant asks her for $90. How much extra money will she have if she hires him?	15
For her 30th birthday, Elvira chose as a gift a new computer with many accessories. She has a budget of 1,500 euros donated by her whole family and thinks she can save some to buy herself a dress. She goes to a computer store and chooses a device that costs 1090 euros with a screen, keyboard and mouse. She also gets a scanner for 157 euros, a CD burner for 74 euros and a printer for 102 euros. How much money will she have left for her clothes?	77
Sandra's neighbor gives her a basket of nine eggs every time she babysits her daughter. To make a Spanish flan, Sandra needs three eggs. If she was assigned to make 15 cream cakes for her school's fundraiser, how many times does she have to babysit?	5
Seth is twice as old as Brooke, so in two years, their ages will add up to 28.	16
Jimmy has two dollars more than Ethel has, so if Ethel has eight dollars, how much money does Jimmy have?	18
Except on the weekend when he walks 10 miles, Pancho walks 20 miles every day.	120
The band orders new uniforms. Each uniform includes a $25 hat, a jacket that's three times the price of the hat, and a pair of pants that's the average price of the hat and jacket. What is the total cost of each uniform?	150
Jake walks through the entomology museum, and he sees 80 eight-legged spiders, 90 six-legged insects, and three rare ten-legged mutant invertebrates. How many legs does Jake see in total?	1210
There are four birds in the Caboose. Sally Two is three years older than Granny Red. Granny Red is twice as old as Sally Four. If Sally Four is the same age as Sally Thirtytwo, and Sally Thirtytwo is eight, what is the total age of the four birds?	51
Jessica wonders how much money she has to pay each month to cover all her debts. The minimum payment on her student loan is $300 a month, her credit card is $200 a month, and her mortgage is $500 a month. If Jessica wants to pay 50 percent more than the minimum, how much does she have to pay in a year?	18000
Billy is peeling and cutting potatoes to prepare a potato salad for his big family barbecue. Since this is a big event, he has 60 potatoes to peel. The potatoes are about the same size, so it takes about the same time to peel and cut them. It takes Billy about a minute and a half to peel a potato, but only 5 seconds to cut it. How long does it take Billy to finish preparing the potatoes?	95
Juan and his brother Carlos sell lemonade. For every gallon they spend $3 on lemons and $2 on sugar. They get 20 glasses of lemonade and sell them for $0.50 a glass. If they made a profit of $25, how much did they spend on lemons?	15
In a race with 240 Asians, 80 of them were Japanese and the rest were Chinese, if the number of boys on the Chinese team was 60, how many girls were on the same team?	100
Zaid spends a quarter of his salary on rent, a third on fuel for his car and donates half of the remaining amount to his favorite charity. He gives $200 to his daughter for her weekly expenses and $700 to his wife for groceries and other household items. If Zaid earns $6,000 a month, how much money will he have left after all these expenses and donations?	350
Rani has ten more crabs than Monique, who has four fewer crabs than Bo. Knowing that Bo has 40 crabs, calculate the total number of crabs.	122
Lloyd makes $10 an hour tutoring maths. He taught five hours the first week and eight hours the next week. How much did he make for the first two weeks?	130
If the winner got three-quarters of the votes and the total number of students who voted was 80, calculate the number of votes the loser got.	20
Sandra, the local florist, is very unhappy with Fred's incomplete delivery. Sandra had ordered four times as many red roses as white carnations. She had also ordered 200 calla lilies roses, five times the amount of white carnations. Sandra threatened to change suppliers if the missing red roses were not delivered by 5 p.m. To keep Sandra as a customer, how many red roses does Fred have to deliver by 5 p.m.?	160
John is two years older than Mark. Two years ago, Mark was five years older than Jan's half the age. If Jan is 30, how old is John?	23
Two teams of athletes compete in a 4 x 400 meter relay, a race where each team has four members who each run 400 meters, or a standard track lap. One of the two teams is very well-rode and each of its members runs the 400 meters in exactly 55 seconds. The other team is less well-rode. Its first runner runs the 400 meters in 60 seconds, and then each following runner is 3 seconds faster than the previous one. Based on this information, in how many seconds will the fastest team win?	2
Jerry rolls a six-sided die, what is the probability (in percent) that he gets a number greater than 3 rather than an even number twice in a row?	25
Jenna and her mother picked apples from their farm. Jenna picked twice as many apples as her mother. If her mother picked 20, how many apples did they pick in total?	30
Russell works in a pet store and distributes straw to the rodents. The rats are divided into three cages in groups of equal size and each rat gets six pieces of straw. There are 10 hamster cages. Each of them is alone in his cage and gets five pieces of straw. There is also a rabbit pen where we distribute 20 pieces of straw. No straw is used elsewhere in the store. If 160 pieces of straw were distributed to the small rodents, how many rats are there in each cage?	5
Mandy owes Benedict $100, and they agreed to a 2% interest rate, so if Mandy is able to pay that amount in three months, how much does she owe Benedict?	106
A merchant buys a few sacks of wheat from a farmer at $20 a sack, knowing that it costs $2 to transport a sack from the farm to the warehouse, and that all the sacks were sold at $30 a sack for a total profit of $400, how many sacks did he sell?	50
Three friends spent $20.25 on three tickets to the fair. They also spent $4.50 less on food than they spent on the tickets. They also did two rides at $33 each. If they agreed to share the cost equally, how much did each pay?	34
John picks peaches for three hours. He picks two peaches a minute. How many peaches did he pick?	360
Ducks need to eat 3.5 pounds of insects a week to survive. How many pounds of insects does a flock of ten ducks need a day?	5
Tom plants 10 trees a year. He also cuts down 2 trees every year. He starts with 50 trees. After 10 years, 30% of the trees die. How many trees does he have left?	91
Sue lives in a neighborhood where there is a good mood. During one weekend, the neighbors decided to play a prank on her. On Friday morning, they placed 18 plastic flamingos in her garden. On Saturday morning, the neighbors took back a third of the flamingos they had painted white and placed them in Sue's garden. Then, on Sunday morning, they added another 18 plastic flamingos to the collection. By noon on Sunday, how many more plastic flamingos were there than white flamingos?	24
Violetta wants to buy new pencils. She needs them in five different colors and has budgeted $20 for this purchase. Knowing that a pencil costs $2, how much change will she have?	10
A pen costs as much as a pencil and a piece of gum put together. If a pencil costs $1.20 and a piece of gum $0.30, what will be the price of eight pens?	12
If you have to distribute 200 pounds of carrots to 40 restaurants in a certain city, if each restaurant is to receive two pounds of carrots, how many pounds of carrots will not be used?	120
In the city of Soda, there are exactly 23,786 inhabitants. 8,417 of them are men and 9,092 are women. The rest of the population is made up of children. How many children are there in Soda?	6277
Elaine started out with 20 Pokemon cards. She collected three times as many after one month. During the second month, she collected 20 fewer cards than she collected in the first month. Finally, during the third month, she collected twice the total number of cards collected in the first two months. How many Pokemon cards does she now have?	320
Marc is a proofreader. He proofreads the same number of sentences each week for two different publishers, who each pay him at a different rate. Publisher B pays Marc twice as much as Publisher A. Marc edits a total of 1,000 sentences per week, while Publisher A pays him 5 cents per sentence. How much does Marc make in a week, in cents?	7500
Baldur draws water from a well. He draws five buckets in the morning and six buckets in the afternoon. If each bucket contains five liters of water, how many liters of water does he collect each day?	55
John gets a prize at work. This prize consists of a one-time bonus of $5,000 and a five percent raise. If he earns $2,000 a week, every week of the year, and he got the prize on the first day of the year, how much money did he make that year?	114,200
Josie grows grapes on her ten-acre farm. She produces five tons of grapes per year on each acre, and each ton of grapes produces two barrels of wine. How many barrels of wine does her farm produce per year?	100
Cheese is Carl's favorite food. He ate a sandwich every day of the week at lunch and used two slices of cheese in each sandwich. He ate cheese and egg omelets for breakfast three days of the week, using one more slice per omelet than he used per sandwich. He made a large plate of macaroni and cheese to ensure several dinners that week and used eight slices of cheese in its preparation. How many slices of cheese did he use in total?	31
Janet had 22 green pens and 10 yellow pens. She then bought six bags of blue pens and two bags of red pens. Each bag of blue pens contained nine and each bag of red pens six. How many pens does Janet have now?	98
Brinley is in Mr. Bert's math class, and Mr. Bert gives six tests per semester, and he allows students to take the worst grade point average of each semester, so if Brinley got scores of 89, 71, 92, 100, and 86 on the first five tests, what score does she need on the sixth test to get an average of 93?	98
Michael loves to ride a bike. He does it at least five times a week and does 25 kilometers each time. He did it for four weeks, then he decided to do it only twice a week, but doing 60 kilometers each time, which he did for three weeks. How many kilometers did Michael do in total?	860
Joe's Halloween candy bag contains 25 chocolate bars and 80 candy apples. Each chocolate bar weighs twice as much as a candy apple. If the chocolate bar weighs 40 grams, what is the weight, in grams, of Joe's candy bag?	2600
On Monday, Rose went to buy four cakes from one store. On Tuesday, she bought three times as many cakes from a different store. On Wednesday, she went to another store and bought five times as many cakes as she bought on Tuesday. How many cakes did she buy in total over those three days?	76
Twenty dozen cups cost $1,200 less than the total cost of half a dozen plates sold for $6,000 each.	145
Sarah wants to buy a new jacket and two pairs of shoes. The jacket she chose costs $30 and each pair of shoes costs $20. Sarah takes care of the neighbor's kids four times and earns $5 each time. Her parents give her $4 every time she mows the lawn. If Sarah already had $10 saved before she started babysitting, how many times does she have to mow the lawn before she can afford the jacket and shoes?	10
Jerry has a chicken farm. Red hens produce three eggs a day, and white hens produce five eggs a day. Jerry collects 42 eggs a day. If he has two more white chickens than there are red ones, how many red chickens does he have?	4
Gary likes to walk along the edge of the local park, which is shaped like a rectangle of 1.5 miles by 6. If he walks at 3 miles per hour, how many hours of walking does he do?	5
At the dollar store, Sloane counts 100 customers coming into the store, and the next day, she counts 50 more than the first day, and if the third day, the total number of customers was 500, how many customers did she count that day?	250
Jerry has two pools, both with leaks that drain them at a rate of four gallons per minute. Four minutes ago, the big pool had twice as much water as the small pool. Now it has four times as much. How much water is in the small pool now?	8
Lori wants to buy a pair of shoes for $320 and a matching belt for $32. Her part-time job pays her $8.00 an hour. How many hours will she have to work before she can make her purchases?	44
If she has to pay $165 a month for 12 months, how much money will Janeth have left by then?	220
There are four roses in the vase and seven more dahlias than there are roses. How many flowers are there in the vase altogether?	15
Adrian is three times older than Harriet, who is half as old as Zack, and calculate the average age of the three in three years' time, if Harriet is now 21.	45
Four students scored a total of 251 points in a board game. Naomi scored 68. Yuri scored 10 points more than Naomi's half, and Brianna 17 more than Naomi. How many points did Jojo score?	54
Carmen takes 10 minutes to finish a crossword puzzle and 5 minutes to finish a sudoku puzzle. Over the weekend, she solved 3 crossword puzzles and 8 sudoku puzzles. How much time did she spend playing these games?	70
A water tank holds 120 liters of water. Celine used 90 liters to water her small garden. She was then able to collect rainwater that is twice as much as what was left. How many liters of water is now in the cistern?	90
Andy plants 90 geraniums and 40 petunias less than the geraniums. How many flowers does he plant in total?	140
