The customs officer at the main port of the SeaSide duty-free zone counts two cargo trunks with five vehicles on each side, and the next day adds another one, and the total number of vehicles at the port becomes 30.	4
Adrian's total salary is 30% more than Layla's total salary. Then four years later, Adrian's salary is up, and he's earning more than he ever did four years ago, 40% if both Adrian and Layla's salary were up together, and four years ago, Adrian earned $40,000, so let's calculate the total salary they both earned four years later.	95200
Miguel uses two sheets of drawing paper a week. If each sheet has 30 sheets, how many sheets does he use in each month?	240
Morrigan and Kyle were asked to bring fruit. Morrigan bought five apples and eight oranges, and Kyle bought twice as many apples and half as many oranges. How many fruits would they have together?	27
Sadeen eight hours on Monday, and then the next two days, she sleeps two hours less every night because she has to finish her assignment, and then the rest of the week, if she sleeps more than two hours, how many hours does she sleep in a week?	48
Rosie can run 10 miles an hour for three hours, then she runs 5 miles an hour, how many miles can Rosie run in seven hours?	50
Jenny is helping in her mother's office, and she has 60 boxes of stamps to be stamped, and one box of stamps that have been stamped, and she stamps a third of the letters that have to be stamped.	10
Julia was preparing food for a dinner party at her house, where she was going to make a stew, and she found that she didn't have a plastic spoon, so she bought a new pack of spoons. Later, her husband bought five different packs of spoons for Julia, one for each of them. While Julia was cooking the stew, she used three spoons to make the stew, and then when she set the table, she had 12 spoons. How many spoons were in the pack that Julia had bought?	10
Dylan had to use chicken and fish crackers to make the chicken breads at the party, and he bought 38 chicken crackers, and he bought more fish crackers than he had six chicken crackers.	82
After moving to a new school, Amy has 20 more friends than Lily has, if Lily has 50 friends, how many friends do Lily and Amy have together?	120
Well, his mother sells tangos, sweet potatoes, and oranges at the local store, but one of the oranges costs three times the price of the sweet potatoes, one of the oranges costs less than the tangos, which is $5 -- so Dylan comes to the store to buy four tangos, 20 sweet potatoes, and 10 oranges, and he has to pay the full amount if the sweet potatoes cost $15 each.	880
One hospital has 500 patients coming in every day, and each patient is seen for an average of 24 minutes, and the doctor charges the hospital $150 an hour, and the hospital charges the patient $200 an hour, and how much profit does the hospital make from these patients seeing the doctor?	10000
Nyssa hired 60 seasonal workers to play Santa Claus' village elves in her mall, one-third of the elves quit after being nauseated by the kids, then 10 of the rest quit after being slapped in the face by the kids.	30
Joseph had $500 in May, he had $60 less in June.	940
Pam and Fred went to a theme park during the festival, Pam played two rounds of roller coasters, Fred played four rounds of roller coasters, and then they decided to play two rounds of car games, each of them playing a game where they had to buy six tickets.	60
On Mondays, Walt walks four miles; on Tuesdays, he walks six times the distance he walked on Mondays; from Monday to Wednesday, he walks a total of 41 miles; on Wednesdays, how many miles does he walk?	13
Tom washes his car four times a month. If each car wash costs $15 how much does he pay for a year?	720
Bobby, Brian's friend, has three times fewer video games than Brian has five. If Brian has 20 video games, but loses five before the comparison, how many video games does Bobby have?	40
There are 27 unicorns left in the world, and one-third of them are in the Scottish Highlands, and two-thirds of the unicorns in Scotland are female.	6
Rory ordered two long-form sandwiches for $7.50 each, two bags of fries for $1.50 each, and two cookies for $1.00 each to be delivered to her home, while she paid for the 20% delivery fee and she wanted an extra $5.00 tip.	29
Yesterday, Mark took a test that had 75 questions, he took it at a rate of five questions per hour, today he took another test with 100 questions, and he took the same rate of answering. If Mark had eight hours to do the first test and six hours to do the second test, how many questions would Mark have left to do?	105
In the coin-shaped box, there are four times as many pink potatoes as there are blue ones, 22 of them. If there are 12 blue potatoes, how many pink potatoes are there in the box?	70
In the 20-car rental line, 12 cars are automatic, four are regular, and the rest are semi-automatic.	20
There are 700 bees in the hive, twice as many worker bees as there are honeybees, and twice as many honeybees as there are bees.	400
Jordan plays video games for two hours a day, and he also works part-time for $10 an hour. How much money would Jordan make in a week if he took his time playing video games and put it into part-time work?	140
John bought two dollars of eggs, three dollars of lamps, three dollars of cups, three dollars of pots, and four dollars of insect traps. If there is a 10% tax on all non-food items, what is the total value of all items?	16
Kim started a housecleaning business and was calculating the profit he would make from each customer. He already had three customers, but he was talking to five potential customers, and he was confident enough to include these five in the profit calculation. Each customer's home would use two bottles of bleach and one pack of cleaning cloths.	20
John has 10 hectares of citrus groves, and each hectare has 100 citrus trees, and John can harvest citrus every three months.	4000
Johnny was putting his toys on the floor in his room, and before he had put 500 Lego boxes on the floor, and then three Lego sets of 500 Lego sets, and then one Lego set of four, how many Lego sets did Johnny put on the floor?	2,125
Debra was checking the hives to see how many bees were coming in and out of the hive in a day, and she saw 30 bees leave the hive in the first six hours, and then she saw half of all the bees leave and come back in the next six hours, and she saw twice as many bees as she had seen leave the hive in the first six hours, and then all the bees that had left before and hadn't come back in the next six hours, and how many bees were returned to the hive in the last six hours of the day.	75
Brittany and her mother went to visit the museum. Admission was $12 for adults and $10 for children. Brittany's mother paid the cashier for one child and one adult. If she got an $8 allowance, how many dollars did she give to the cashier?	30
Charlie has three times as many Facebook friends as Dorothy, James has four times as many Facebook friends as Dorothy. If Charlie has 12 Facebook friends, how many Facebook friends does James have?	16
Steve and Tim decided to compete to see who could get home from school faster. Steve's home was farther away than Tim's, so he was allowed to ride a bike. Steve was three miles from school and could cycle at 440 feet per minute, and Tim was two miles from school.	4
So Shaunda saw that the kids in the neighborhood would definitely want to use a tire-cleaning service, and she decided that the best way to charge for the service was by the number of tires, and the cost of each tire was 25 cents. The first day, five cyclists were cleaning two tires, and three were cleaning all three tires of the three-wheeler.	5
Carl bought ten packs of cookies, each packet with six cookies inside, each cookie cost $0.10 how much money would Carl get if he paid with a $10 bill?	4
Dave bought a big bag of French fries and ate 14 of them before a hungry gull stole them from his hand. When the gull flew to the ground, he ate half of them. Then three pigeons came and chased the gull away from the food, and each dove took three of the fries. Then the raccoon stole two-thirds of the fries, and then he stole the last one, and there were five left.	48
On Mondays, Wednesdays and Fridays, Kyomo, as a student, attends three classes a day, each one an hour long, and on Tuesdays and Thursdays, he attends two classes a day, each two hours long, for a 16-week semester. Kyomo spends four hours with the class.	272
Bill would have 300 rolls of bread, 120 chocolate bars, and 60 baskets of bread every day, each roll four inches long, each square six inches long, and each basket two feet long.	280
The keeper feeds all the monkeys in the zoo, and every two months he orders all the bananas from the local garden. If in a month the monkey wants 200 bananas, the gorilla wants 400 bananas, and the baboon wants 100 bananas, he has to order how many bananas, so that's enough for two months.	1400
Belg and Kelly competed to see who could run the longest in 15 minutes, and they decided to compete on a 100-yard football field. Belg ran back and forth 15 times, Kelly ran back and forth once, and then decided she didn't want to run next to Belg. Belg started running to the 40-yard line and then ran back and forth, doing this 34 times, the winner running farther than any loser.	80
Rafael went out to buy school supplies, he bought pens for $1.5 each, four pens, two notebooks for $4 each, and a good quality paper for $20 each.	34
Finn sees 11 eggs swimming in the pond, and then he sees six eggs in a group coming out of the hole under the well, and then he sees two eggs in a group going under the rock, and now Finn is going to see how many eggs in the pond.	15
One tank was 17 feet deep on Monday, then on Tuesday it was seven feet deep, and on Wednesday it was two-thirds of what it was on Tuesday.	16
Today Anakin and Loxin went to the beach, Anakin caught 10 trout, 6 salmon, and 3 trout, and Loxin caught less than 5 trout, less than 3 salmon, and more than 2 salmon.	32
If a glass bag costs $20 and the price goes up 20% from the original price every two months, what would a glass bag cost after 36 months?	92
In the room, there are all kinds of toys: five red cars, three action figures, and one doll, which is worth three action figures, and the red car is worth $4 each.	50
Jackie was trying to decide whether to file her own taxes or hire an accountant. If she filed her own taxes, she would have three fewer hours of freelance work, costing her $35 an hour. The accountant charged $90 if she hired an accountant to file her taxes.	15
Elvira chose a new computer with a lot of accessories as a 30th birthday present. She had a budget of €1,500 that everyone in her family had collectively given her, and she thought she had a little money left over to buy clothes. She went to a computer store and chose a computer for €1,090 that came with a screen, a printer and a mouse. She also bought a scanner for €157, a CD recorder for €74, and a printer for €102.	77
Sandra's neighbor would give her a can of eggs, which contained nine pounds of eggs, for every time she helped her daughter, Sandra would need three pounds of eggs to make a Spanish pancake. If Sandra was assigned to make 15 Spanish pancakes for a school charity, how many times would Sandra have to help her neighbor's daughter?	5
Seth is twice as old as Brooke, so in two years, their combined lifespan will be 28 years.	16
Jimmy has twice as much money as Ethel has, which is $2. If Ethel has $8, how much money does Jimmy have?	18
Pancho walks 20 miles a day, except on weekends he walks 10 miles.	120
The military ordered a new uniform, with each uniform coming with a $25 hat, a three-piece jacket, and pants that averaged the price of the hat and jacket.	150
Jake was walking through the museum of geology, and he saw 80 spiders, each with eight legs, 90 mosquitoes, each with six legs, and three rare mutant invertebrates, each with 10 legs.	1210
If the cabbage has four birds, Sally Two is three years older than Granny Red, Granny Red is twice as old as Sally Four, if Sally Four is the same age as Sally Thirtytwo and Sally Thirtytwo is eight years old, how old are all four birds?	51
Jessica tries to figure out how much she's going to pay off all of her debts each month, her student loans have a $300/month limit, her credit cards have a $200/month limit, and her mortgage is $500/month.	18000
Billy was peeling and chopping potatoes to prepare the potato salad for his big family barbecue, which was a big event, so he prepared 60 potatoes, and they were about the same size, so it took about the same amount of time to peel and chop each potato.	95
Juan and Carlos, his brother, were selling lemonade at $3 a gallon for lemonade and $2 for sugar, and they were selling a glass for $0.50 and selling 20 glasses a gallon, so if they made a profit of $25, how much did they buy?	15
In a tournament with 240 Asians, 80 Japanese, and the rest Chinese, if the number of boys in the Chinese team is 60, how many girls are in the Chinese team?	100
Sad spends a quarter of his salary paying rent, a third paying gas, and half of the rest he donates to his favorite charity, giving his daughter $200 for her weekly expenses and his wife $700 to fund her groceries and other household items.	350
If Ronnie has 10 more cards than Monica, Monica has 4 fewer cards than Bo, if Bo has 40 cards, then count the total number of cards that all three of them have combined.	122
Lloyd gets $10 an hour for doing math, he teaches five hours the first week, eight hours the second week, so what's the total amount he made in the first two weeks?	130
Two candidates ran for class representation in a school in Sarai, if the winner gets three-quarters of the votes, and the voting class has 80 students, count the votes the loser gets.	20
Sandra, a local florist, was particularly unhappy with Fred's incomplete delivery. She ordered four times as many red roses as white carnations. She also ordered 200 pink cacalli lilies, five times as many white carnations. Sandra threatened to change the air supply if she did not deliver the missing red roses by 5:00 p.m.	160
Young is two years older than Mark. Two years ago, Mark was more than half as old as Jan. Five years. If he's 30 now, how old is Jung?	23
Two teams of sprinters are competing in the 4x400-meter relay, a race in which each team has four members who each run 400 meters or one lap of the standard sprint. One of these teams is the best, with each member running the 400 meters in exactly 55 seconds, the other less than the best. The first runner of the team runs the 400 meters in 60 seconds, then each runner who follows is three seconds faster than the runner before him, based on how many seconds the team that is faster will win.	2
Jerry is rolling a six-sided die, the probability (expressed as a percentage) that he rolls a higher number than three is greater than the probability that he rolls two consecutive even numbers.	25
Jenna and her mom pick apples from the apple farm, and Jenna gets half of what her mom gets, so if her mom gets 20 apples, how many apples do they both get?	30
Russell works at a pet store and he's distributing fangs to the various rodents, and he's keeping mice in three cages, divided equally, so each mouse has six fangs, and there's a separate cage of hamsters, 10 of them, and each hamster has five fangs, and there's a rabbit's foot, and he's distributing 20 fangs to all the rabbits, and he doesn't have to distribute any more fangs in the store, and if he distributes 160 fangs to all the small rodents, there's four cubs in each cage.	5
Mandy owed Benedict $100, and they agreed to pay 2% interest per month if Mandy could pay the debt in three months, so how much should she pay Benedict?	106
A merchant buys a certain amount of grain from a farmer for $20 a bag. If each bag of grain from the farm to the warehouse costs $2 and the merchant makes a total profit of $400 after selling each bag at $30 a bag, how many bags of grain did he sell?	50
Three friends spent $20.25 on three tickets to the show, they spent less on food than they did on $4.50 tickets, and they got to sit on two different machines, paying $33 for each game, if they agreed to split the total cost equally between each person.	34
John collects peaches for three hours, and he can collect two peaches per minute.	360
A duck needs to eat 3.5 pounds of insects per week to survive, and if there's a flock of 10 ducks, how many pounds of insects does the flock need to eat in a day?	5
Tom plants 10 trees a year, and every year he cuts down two trees, too. He starts by planting 50 trees, and after 10 years, 30 percent of the trees are dead. How many trees will he have left?	91
Sue lives in a fun neighborhood, and one weekend, her neighbor decided to play a prank on her. On Friday morning, the neighbor put 18 pink flamingos in Sue's front yard. On Saturday morning, the neighbor put a third of the flamingos back in white, and then put the newly painted white flamingos back in Sue's front yard. Then on Sunday morning, they added 18 more pink flamingos to the collection. By noon on Sunday, there were four pink flamingos out of the white flamingos.	24
Violeta wants to buy a new candle, she wants five colors of candle, and she has the money to buy $20 of it, and the color is $2 per candle, so how much money does she get?	10
A pencil and eraser cost the same as a pencil and eraser combined. A pencil is $1.20 and a eraser is $0.30. How much would eight pencils cost?	12
200 pounds of carrots were distributed to 40 restaurants in one city, with each restaurant getting 2 pounds of carrots, how many pounds of carrots were left unused?	120
In Sodami, there are 23,786 inhabitants, consisting of 8,417 men and 9,092 women, the rest of the population being children.	6277
The first month, Ellen had 20 Pokemon cards, and after a month, she had three times that number of cards, the second month, she had fewer cards than she had in the first month, 20 Pokemon cards, the third month, she had twice the number of Pokemon cards she had in the first month and the second month combined, so now she has how many Pokemon cards?	320
Mark was the original editor, he checked out the same number of revisions to two different publications each week, each paying him a different rate per sentence; Publication B paid Mark twice as much as Publication A. Mark checked out 1,000 sentences a week, and Publication A paid him 5 cents a sentence.	7500
Baldur pumped water from a well, he pumped five buckets every morning and six buckets every afternoon. If each bucket had five liters of water, how many liters could he pump?	55
John got a bonus from work, this bonus was a one-time $5000 bonus and a 5% raise if he made $2000 a week every week for a year and he got this bonus on the first day of the year, how much money did he make that year?	114,200
Josie grows grapes on her 10-acre farm, where each acre produces five tons of grapes a year, and each ton of grapes produces two barrels of wine.	100
Carl's favorite food is cheese. This week he ate one sandwich for lunch every day and put two slices of cheese in each sandwich. He ate a cheese egg for breakfast three days a week, putting more cheese in the cheese egg than in the sandwich. He made a big cheese macaroni for dinner for several days a week, putting eight slices of cheese in it.	31
Janet had 22 green pens and 10 yellow pens, and then she bought six bags of blue pens and two bags of red pens, and each bag of blue pens had nine pens and each bag of red pens had six pens.	98
Brinley was in Cuthbert's math class, and Cuthbert would give her six tests per term, allowing her to subtract the lowest score from the average score for each term. If Brinley scored 89, 71, 92, 100, and 86 on the first five tests, how many points would she need to score on the sixth test to get an average of 93 points?	98
Michael loved to ride his bike, he rode his bike at least five times a week, and each time he did 25 kilometers, and he did that for four weeks, and then he decided that he would only cycle twice a week, but he would cycle 60 kilometers, and he did that for three weeks.	860
Joey's Halloween cake bag contains 25 bars of chocolate and 80 sugar-coated apples, each bar of chocolate weighing twice as much as one bar of sugar-coated apples. If each bar of chocolate weighs 40 grams, how many grams of cake would Joe's cake weigh?	2600
Rose goes to the store on Monday and buys four pieces of cake, on Tuesday she goes to another store and buys three times as many cakes, on Wednesday she goes to another store and buys five times as many cakes as she bought on Tuesday, and in three days, how many cakes did she buy?	76
Twenty cups are less than the total price of half a dozen plates, which sold for $6,000 at $1,200.	145
Sarah wants to buy herself a new jacket and two pairs of shoes. The jacket she wants costs $30, the shoes cost $20 each. Sarah helps babysit four neighborhood kids, earning $5 for each babysitting. Her parents give her $4 for each lawn she cuts. If Sarah had $10 saved up before she started babysitting, how many lawn cuts would she have to do to buy the jacket and shoes?	10
Jerry has a flock of chickens, and the red chickens lay three eggs a day, and the white chickens lay five eggs a day, and every day Jerry collects 42 eggs.	4
Gary likes to walk around the edge of the local park, which is a rectangle of cloth measuring 1.5 miles by 6 miles. If he walked at 3 miles per hour, how many hours would it take him to walk?	5
At a dollar store, Sloan counts 100 customers coming in, and the next day she counts 50 more than the first day, so if the total is 500 customers by the third day, how many customers does she count on the third day?	250
Jerry has two pools, both leaking four gallons a minute, and four minutes ago, the big pool had twice the amount of water than the small pool, and now the big pool has four times the amount of water than the small pool.	8
Lori wants to buy $320 shoes and $320 seat belts, part-time work that pays her $8 an hour, how many hours of work does she have to do to afford these things?	44
Janet borrowed $2,000 and promised to pay back 10% of the money if she paid $165 a month for 12 months, and by then, how much money would Janet have left?	220
In the bouquet there are four roses, more roses than seven roses.	15
Adrian is three times older than Harriet, and Harriet is half as young as Zach. If Harriet is 21 now, calculate the average age of all three over the next three years.	45
The four students scored a total of 251 points in the board game, with Naomi scoring 68, Yuri scoring more than half of Naomi's 10 points, and Brianna scoring more than Naomi's 17 points.	54
Carmen takes 10 minutes to do a puzzle and 5 minutes to complete a sudoku, and over the weekend, she solves 3 puzzles and 8 sudoku.	70
A single tank holds 120 liters of water, and Selene uses the water from a 90-liter tank to water her little garden, so she can store twice as much rainwater as she has left.	90
Andy planted 90 geraniums and 40 less geraniums, and how many flowering plants did he grow?	140
A company spends $15,000 on advertising for one year, then spends a third of that on advertising for another year, and then two years later, what's the total amount of advertising that company spends?	20000
Carlos and Benji are on the beach, Carlos rents a canoe for $30 an hour, Benji rents a pampana for $18 an hour, so if Carlos uses the boat for three hours and Benji uses the pad for five hours, how much do they pay in rent altogether?	180
Andrew planned a road trip from New Jersey to Rochester, which would take six days to travel by bus and half a day to travel by car from New Jersey to Rochester. If he planned to travel to Rochester by bus and back from Rochester by car, how many days would it take him to travel?	9
James is counting his Pokémon cards, he has 30 fire elements, 20 grass elements, and 40 water elements, so if he makes 8 missing water elements and buys 14 grass elements, what is the percentage chance that he will get water elements (the remainder being the nearest whole number)?	33
Chad ordered a custom-made burrito for lunch, with the basic burrito for $6.50; he added the meat for $2.00, added the cheese for $1.00, added the avocado for $1.00, and added two sauces for $0.25 each; he decided to upgrade his meal for an additional $3.00, which would add fries and drinks; he had a $5.00 gift card that expired at checkout; how much more did he have to pay?	9
Kalinda is doing 360 jigsaw puzzles with her mother, and Kalinda can usually do four puzzles per minute, and Kalinda's mother can do more than her in half a minute, so it would take two more hours to finish this puzzle.	1
One field of mangoes produced 120 mangoes. Ashlyn went to the field after two months and found that 30 percent of the mangoes were ready for harvesting, so she took them home when she returned to the field two weeks later, but the other three-quarters were ready. She harvested those mangoes. How many were not ready for harvest after two weeks?	21
Mark bought 12 cars for his company, each sold for $20,000, paid 10% vehicle tax, and paid $1,000 for each car's registration fee, so what did he pay in total?	276,000
Kyle and Robert like to go to the beach to collect seagulls. On Monday, Kyle collects more seagulls than Robert, who collects 20 seagulls in five sets. On Tuesday, Kyle collects twice as many seagulls as he collects on Monday.	50
Dax goes to the farm to pick apples and finds more than half the insects in the garden. If there are 50 ants, count the number of insects in the garden.	75
There were 36 penguins sunbathing in the snow, then a third of them jumped into the sea to swim, while another third went to dinner in the cave, so how many penguins were still sunbathing?	12
